가수명,노래제목,발매일,가사,좋아요수
박효신,별 시 (別 時),2018-04-30,You are my star 이 노래는 너야 불빛 하나 없는 길을 걷게 해 줄 기나긴 밤 쓰다 만 이 노래의 의미를 찾고 있어 나 여기서 두 팔 벌려 힘껏 달려와 내게 입 맞추던 그 눈빛을 그 사랑을 기다리고 있어 나였다면 언젠가 돌아본 그곳에 너를 바라보던 그 하늘이 나였다면 다시 나의 별이 되어줘 주머니 속 내 손을 꼭 잡고 형편없는 나의 말에 웃어주던 그리운 밤 아무 일 없는 듯이 전화를 걸고 있어 나 여기서 두 팔 벌려 힘껏 달려와 내게 입 맞추던 그 눈빛을 그 사랑을 기다리고 있어 나였다면 언젠가 돌아본 그곳에 너를 바라보던 그 하늘이 나였다면 내가 너의 밤이 돼 줄게 어느 멋진 날 너에게 줄 노래 ,61064
아이유,싫은 날,2013-12-20,키 큰 전봇대 조명 아래 나 혼자 집에 돌아가는 길 가기 싫다 쓸쓸한 대사 한 마디 점점 느려지는 발걸음 동네 몇 바퀴를 빙빙 돌다 결국 도착한 대문 앞에 서서 열쇠를 만지작 만지작 아무 소리도 없는 방 그 안에 난 외톨이 어딘가 불안해 TV 소리를 키워봐도 저 사람들은 왜 웃고 있는 거야 아주 깜깜한 비나 내렸음 좋겠네 좋겠네 텅 빈 놀이터 벤치에 누군가 다녀간 온기 왜 따뜻함이 날 더 춥게 만드는 거야 웅크린 어깨에 얼굴을 묻다가 주머니 속에 감춘 두 손이 시리네 어제보다 찬 바람이 불어 이불을 끌어당겨도 더 파고든 바람이 구석구석 춥게 만들어 전원이 꺼진 것 같은 기척도 없는 창 밖을 바라보며 의미 없는 숨을 쉬고 한 겨울보다 차가운 내 방 손 끝까지 시린 공기 봄이 오지 않으면 그게 차라리 나을까 내 방 고드름도 녹을까 햇볕 드는 좋은 날 오면은 ,49488
아이유,이름에게,2017-04-21,꿈에서도 그리운 목소리는 이름 불러도 대답을 하지 않아 글썽이는 그 메아리만 돌아와 그 소리를 나 혼자서 들어 깨어질 듯이 차가워도 이번에는 결코 놓지 않을게 아득히 멀어진 그날의 두 손을 끝없이 길었던 짙고 어두운 밤 사이로 조용히 사라진 네 소원을 알아 오래 기다릴게 반드시 너를 찾을게 보이지 않도록 멀어도 가자 이 새벽이 끝나는 곳으로 어김없이 내 앞에 선 그 아이는 고개 숙여도 기어이 울지 않아 안쓰러워 손을 뻗으면 달아나 텅 빈 허공을 나 혼자 껴안아 에어질 듯이 아파와도 이번에는 결코 잊지 않을게 한참을 외로이 기다린 그 말을 끝없이 길었던 짙고 어두운 밤 사이로 영원히 사라진 네 소원을 알아 오래 기다릴게 반드시 너를 찾을게 보이지 않도록 멀어도 가자 이 새벽이 끝나는 곳 수없이 잃었던 춥고 모진 날 사이로 조용히 잊혀진 네 이름을 알아 멈추지 않을게 몇 번이라도 외칠게 믿을 수 없도록 멀어도 가자 이 새벽이 끝나는 곳으로 ,213810
선우정아,그러려니,2016-02-29,만나는 사람은 줄어들고 그리운 사람은 늘어간다 끊어진 연에 미련은 없더라도 그리운 마음은 막지 못해 잘 지내니  문득 떠오른 너에게 안부를 묻는다 잘 지내겠지 대답을 들을 수 없으니 쓸쓸히 음 음 그러려니 잘 지내니  문득 떠오른 너에게 안부를 묻는다 잘 지내겠지 대답을 들을 수 없으니 쓸쓸히 음 음 그러려니 그러려니 만나는 사람은 줄어들고 그리운 사람은 늘어간다 끊어진 연에 미련은 없더라도 그리운 마음은 막지 못해 만나는 사람은 줄어들고 그리운 사람은 늘어간다 끊어진 연에 미련은 없더라도 그리운 마음은  그리운 마음은 ,28333
백아연,할 말,2016-05-24,어려운 말을 꺼내요 그 동안 그댈 기다리는 것 말고는할 수 있는 게 없던 나죠 이제 우리 여기까지만 해요 너무 많은 말들이 맘속에 차올라 나는 나는 할 말이 없어요 그저 나는 할 말이 없어요 그렁그렁 눈물이 차오고 가슴 한쪽이 너무 아려와 아무 말도 못했죠이젠 그만할래요차가운 그대 눈빛에 울던 나는갈게요 이젠 good bye조금씩 준비를 했어요자꾸 변하는 그대가 다시는돌아 올 것 같지 않아서요그댄 정말 끝인 거냐 하네요마치 하나도 몰랐었던 것처럼불편하게그렁그렁 눈물이 차오고가슴 한쪽이 너무 아려와아무 말도 못했죠너무 멀리 왔어요차가운 그대 눈빛에 울던 나는갈게요 이젠 good bye그때 우리 마주 보던그대에게 기대어 웃던따뜻했던 기억들은다 남겨둘게요처음 우리 시작했던 날그때처럼만 안녕 안녕 해요너무 많이 아팠나 봐요다시 잡는 그대 그 손길을이제 받아줄 수 없네요안녕 난 갈게요 이젠Good bye,9840
손동운,Decrescendo,2019-04-22,내게 주던 사랑이갈수록 익숙해져편하게 생각했나 봐날 떠나 가벼워진 사랑은이제야 겨우 떠올라날카로운 말들로서로 맘을 할퀴다깎여버린 네 마음은끝까지 아물지도 못 한 채상처란 조각이 됐나 봐사랑 이상의 감정을 너라고부르던 시간이 끝나면어떻게 말해야 할지 몰라이별이라 부르기로 했어Decrescendo무한하게 커져가던 사랑도이별이란 두 글자에 갇혀방향을 잃고 점점 여려져귓가에 울리던 우리 노래는들리지 않을 만큼 작아져 가닮아 가는 모습에거울을 보는 것 같아널 보는게 좋았는데사실은 그렇게 반대로만바라보고 있었던 거야이별은 갑작스레 다녀가고그 자리에 남은 건너의 마지막 선물이라 생각해추억이라 부르기로 했어Decrescendo무한하게 커져가던 사랑도이별이란 두 글자에 갇혀방향을 잃고 점점 여려져귓가에 울리던 우리 노래는들리지 않을 만큼 작아져 가Decrescendo무한하게 커져가던 사랑도이별이란 두 글자에 갇혀방향을 잃고 점점 여려져귓가에 울리던 우리 노래는들리지 않을 만큼 작아져 가,3906
홍민정,아마도 그건,2008-11-28,아마도 그건 사랑이었을거야희미하게 떠오르는 기억이이제야 그 마음을 알아버렸네그대 눈에 비친 나의 모습을아마도 그건 사랑이었을거야돌아보면 아쉬운 그날들이자꾸만 아픔으로 내게 찾아와떨리는 가슴 나를 슬프게 하네차가운 내 마음에 남은 너의 뒷모습열린 문틈으로너는 내게 다가 올 것 같아한참을 멍하니 문만 바라보다아침햇살에 눈을 뜨고 말았네사랑 그것은 엇갈린 너와 나의 시간들스산한 바람처럼 지나쳐갔네사랑 그것은 알 수 없는 나의 그리움남아 있는 나의 깊은 미련들차가운 내 마음에 남은 너의 뒷모습열린 문틈으로너는 내게 다가 올 것 같아한참을 멍하니 문만 바라보다아침햇살에 눈을 뜨고 말았네사랑 그것은 엇갈린 너와 나의 시간들스산한 바람처럼 지나쳐갔네사랑 그것은 알 수 없는 나의 그리움남아 있는 나의 깊은 미련들사랑 그것은 엇갈린 너와 나의 시간들스산한 바람처럼 지나쳐갔네사랑 그것은 알 수 없는 나의 그리움남아 있는 나의 깊은 미련들,27493
에피톤 프로젝트,한숨이 늘었어 (Duet With 이진우),2010-05-12,요즘 재밌다는 영화유행하는 것들 일부러 찾곤 해조금 웃을 수 있어서잠깐 잊을 수 있어서낮은 한숨이 늘었어이유 없는 일에 눈물을 흘리고때론 당연한 하루가가끔 너무 속상해서우리 사랑했었던 날들우리 함께했었던 기억 떠오르면좋은 기억들 보다는아직 미안한 맘이 더 많아우리 사랑했었던 날들우리 함께했었던 기억 떠오르면이젠 어쩔 수 없어서다시 한숨을 짓곤 해우리 사랑했었던 날들우리 함께했었던 기억 떠오르면좋은 기억들 보다는아직 미안한 맘이 더 많아우리 사랑했었던 날들우리 함께했었던 기억 떠오르면이젠 어쩔 수 없어서다시 한숨을 짓곤 해,3824
진영 (GOT7),그날,2017-07-31,누가 말 걸어 주지 않으면아무 말 없이나도 모르게 찾게 되는 건한가지 너고요했던 이 바다 위에햇살이 저물어 갈 때 쯤어렵게 끝맺은 이 멜로디 위에서있어 나 혼자그때의 목소리 그때의 공기파도가 되어서 부딪쳐도난 기다려 언젠가 가라 앉길또 기도해 하늘에 닿을 때 까지간절해져 갈수록잊고 있던 기억들이 날 찾아와모든 게 다 좋았던 거라믿었던 그날이눈앞에서 멀어져가던 걸 보던 그날을생각해내 뺨을 스치는 바람이내 맘을 흔드는 파도소리기도가 하늘에 닿았나 봐더 크게 소리쳐 빛 바래지지 않게바짝 깎은 내 손톱 밑에새살이 아물어갈 때 쯤어렵게 끝맺은 이 멜로디 위에그때의 목소리 그때의 공기파도가 되어서 부딪쳐도난 기다려 언젠가 가라 앉길또 기도해 하늘에 닿을 때 까지간절해져 갈수록잊고 있던 기억들이 날 찾아와모든 게 다 좋았던 거라믿었던 그날이눈앞에서 멀어져가던 걸 보던 그날을모든 게 다 무너져버린 것 같던 그날이아무렇지 않게 잊혀져나 웃던 그날을생각해,10594
장나라,그게 정말이니?,2003-12-03,후회는 없을거라고 그만큼 사랑했다고지금 흔들리는 목소리로이별을 얘기하는거니사랑한 순간이야 그래 나도 기억하니까니 말대로 후회는 없을꺼야잊을순 없겠지만그게 정말이니 너 돌아서는모습이 정말 마지막이니아무말 없이 너를 보내고 난 뒤에후회하면 어떡하니어쩌면 너의 말처럼 조금씩 잊혀진대도아직까지는 나 단 하루도 너 없인 안되는데그게 정말이니 너 돌아서는모습이 정말 마지막이니아무말 없이 너를 보내고 난 뒤에 후회하면 어떡하니지금이라도 널 품에 안고괜찮아 하면 돌아올꺼니지나간 날에 이쁜추억 하나로이렇게 너 남는거니이렇게 멀어져 가는 그대그저 힘없이 바라볼 뿐소리쳐 불러봐도 잡을수 없기에이건 안 된다고 가지 말라고제발 내곁에 있어 달라고마음속으로 너를 한없이 불러도아무 소용 없겠지만자꾸 돌아보며 머뭇거리는저 멀리 니 모습 때문에너로 인해서 행복했던 나란걸지금에야 알게 됐어 이렇게,9600
아이유,마침표,2017-04-21,알고 있었어 무슨 말인지무슨 마음인지 다 알아하루 더 딱 하루만 더미루고 싶었어그래야겠지 결국 언젠간제일 어려운 숙제를 해야지마지막 인사가 이렇게 늦어서 미안많이 보고 싶지만널 다시는 만나지 않았음 좋겠어아파 울지만 다신 너로 인해웃지 않았음 좋겠어한 움큼씩 나눴던 진심도너무 쉬웠던 대답도못 잊게 사랑한 여러 번의 계절도안녕 모두 안녕전부 알 것 같아도 더 이상의이해는 없었음 좋겠어묻고 싶지만 끝내 그 대답을듣지 못했음 좋겠어변함없이 정직한 두 눈도약속한 겨울바다도못 잊게 행복했던 어린 날의 나도안녕 모두 안녕안녕 모두,67534
스윗소로우 (SWEET SORROW),서울은 비,2015-10-15,오늘 따라 내리는 이 비는좀처럼 그치질 않네요혹시 그대 있는 곳에도지금처럼 비가 내리진 않을까요아주 멀리 있어도 변하는 건없을 거야 우리서로 향해 있다면 언제까지나 함께일 거야그대 말했죠 또 내게 말했죠기도처럼그대가 그리워지면너무 보고프면 나는 이렇게 아픈데그대는 괜찮은가요아무 말 없는 그대가 나는 겁이 나서울은 비가 와외로운 내 맘에 돌아와 돌아와이 비가 그쳐가그대 고운 얼굴을 그려도 그려도 보이질 않아요달라지게 된 하루만큼 멀어짐은어쩔 수는 없는 건가요아주 멀리 있어도 변하는 건없을 거야 우리서로 향해 있다면 언제까지나 함께일 거야그랬잖아요 그랬었잖아요그대 내게그대가 그리워지면너무 보고프면 나는 이렇게 아픈데그대는 괜찮은가요아무 말 없는 그대가 나는 겁이 나서울은 비가 와외로운 내 맘에 돌아와 돌아와이 비가 그쳐가,3226
지코 (ZICO),사랑이었다 (Feat. 루나 of f(x)),2016-01-25,알 수 없다눈 뜨고 꿈꾸는 기분일까괜히 가슴이 소란스러워지고그리움도 경험해본다내게 짓던 웃음이 참 예뻤지만네 맘은 항상 표정을 짓지 않아상처 난 것들을 보여주면서치유받길 거절하는 널 보며내가 할 게 못 되는구나 힘들다시간 지나면 다 없었던 일잠시 미쳤다 생각했는데사랑이었다 사랑이었다이제 와 보니 사랑한 거였다나답지 않던 말과 행동이멋대로 굴고 있는 심장이사랑이었다 사랑이었다나보다 소중한 게 있었다언제쯤 넌 내 이름 불러줄까널 꺾는다고 그 향기가 내 게 될까넌 쓸쓸함에 대해 얘기하면서안아주려는 내 손을 밀쳤어체념할 자격도 없는 나 괴롭다시간 지나면 다 없었던 일잠시 미쳤다 생각했는데사랑이었다 사랑이었다이제 와 보니 사랑한 거였다나답지 않던 말과 행동이멋대로 굴고 있는 심장이사랑이었다 사랑이었다나보다 소중한 게 있었다이제 더 이상은 특별함을 찾지 않아널 쫓느라 두고 간 원래의 나를 찾아혼자 한 사랑은 스스로 이별해야 되네시간 지나면 다 없었던 일잠시 미쳤다 생각했는데사랑이었다 사랑이었다이제 와 보니 사랑한 거였다나답지 않던 말과 행동이멋대로 굴고 있는 심장이사랑이었다 사랑이었다나보다 소중한 게 있었다나보다 소중한 게 있었다,121044
