가수명,노래제목,발매일,가사,좋아요수
백예린 (Yerin Baek),그럴때마다,2021-09-10,반복된 하루 사는 일에 지칠 때면 내게 말해요 항상 그대의 지쳐있는 마음에 조그만 위로 돼줄게요 요즘 유행하는 영화 보고플 땐 내게 말해요 내겐 그대의 작은 부탁조차도 조그만 행복이죠 아무런 약속도 없는 일요일 오후 늦게 잠에서 깨 이유 없이 괜히 서글퍼질 땐 그대 곁엔 세상 누구보다 그댈 이해하는 내 자신보다 그댈 먼저 생각하는 사람이 있죠 오랫동안 항상 지켜왔죠 그대 빈자리 이젠 들어와 편히 쉬어요  혼자서 밥 먹기 싫을 땐 다른 사람 찾지 말아요 내겐 그대의 짜증 섞인 투정도 조그만 기쁨이죠 아무런 약속도 없는 일요일 오후 누군가 만나서 하루 종일 거릴 걷고 싶을 땐 그대 곁엔 세상 누구보다 그댈 이해하는 내 자신보다 그댈 먼저 생각하는 사람이 있죠  오랫동안 항상 지켜왔죠 그대 빈자리 이젠 들어와 편히 쉬어요,33255
권진아,위로,2019-09-29,세상과 다른 눈으로 나를 사랑하는 세상과 다른 맘으로 나를 사랑하는 그런 그대가 나는 정말 좋다 나를 안아주려 하는 그대 그 품이 나를 잠재우고 나를 쉬게 한다 위로하려 하지 않는 그대 모습이 나에게 큰 위로였다 나의 어제에 그대가 있고 나의 오늘에 그대가 있고 나의 내일에 그대가 있다 그댄 나의 미래다 나와 걸어주려 하는 그대 모습이 나를 웃게 하고 나를 쉬게 한다 옆에 있어주려 하는 그대 모습이 나에게 큰 위로였다 나의 어제에 그대가 있고 나의 오늘에 그대가 있고 나의 내일에 그대가 있다 그댄 나의 미래다 ,6554
구원찬,너는 어떻게 (Original ver.),2018-12-26,사랑 그 단어 안에 담겨진 기억들은 다른 어떤 것보다 더 간직하게 되는 하나뿐인 그대 홀로 걷던 나의 맘을 만지고 잊혀질 수 없는 어떤 영화 같은 장면들처럼 너는 어떻게 이토록 날 웃게 하는지 굳이 말을 하지 않아도 다 알 것 같은 걸 어떤 이유도 없이 단지 그댄 내 사랑이라서 Babe I'm loving you 너는 어떻게 이런 나를 사랑하는지 내가 날 봐도 나는 참 못난 사람인데 하나뿐인 그대 그대 때문에 난 웃을 수 있고 지워질 수 없는 그런 기억들을 함께하면서 너는 어떻게 이토록 날 웃게 하는지 굳이 말을 하지않아도 다 알 것 같은 걸 어떤 이유도 없이 단지 그댄 내 사랑이라서 Babe I'm loving you 혹시나 어려운 일들이 있다면 어떤 벽이든 괜찮아 우린 넘을 테니까 언제나 내 맘은 그댈 사랑한다 말할게 서로가 하나 되는 것 사랑 어떤 이유도 없이 단지 그댄 내 사랑이라서 Babe I'm loving you ,3539
박원,어젯밤에,2016-11-17,어젯밤에 내 맘은 두근두근 내 꿈이 이뤄지기 전 날밤 많은 사람들 나 노래하면 모두 반하게 해줄 거야 당신도 어제 밤새 뒤척였나요 나처럼 어제 밤새 설레었나요 어젯밤에 내가 그려본 당신의 모습보다 훨씬 아름답네요 당신도 어제 밤새 뒤척였나요 나처럼 어제 밤새 설레었나요 어젯밤에 내가 그려본 당신의 모습보다 훨씬 아름답네요 당신의 모습보다 훨씬 훨씬 아름답네요 ,2717
어반자카파,아직도 나를 사랑한다면,2016-05-27,노래를 불러요 우릴 헤어지게 만든 그 노래를 이 일만 끝나면 더 잘할 수 있다고 그댈 괴롭히던 그 노래를 불안한 우리가 더 좋은 얘길 만들어 주겠죠 이런 거 싫지만 그댈 더 원하지만 결국 만들었네요 이 노래를 아직도 나를 사랑한다면 혹시 아직 나를 기다리면 전활 걸어줘요 아직도 나를 사랑한다면 혹시 아직 나를 기다리면 아직도 나를 사랑한다면 혹시 아직 나를 기다리면 전활 걸어줘요 아직도 나를 사랑한다면 혹시 아직 나를 기다리면 ,7655
Collective Arts (콜렉티브아츠),나의 그늘,2017-07-27,나의 그늘이 좋다고 하는 너에게 무슨 말을 해야 좋을까 이 순간에도 가난한 나의 마음인데도 넌 왜 웃어 보일까 미운 말을 쏟아내 상처 주긴 쉬운데 넌 왜 아직 거기 서 있는데 해는 뜨지 않는데 내게 기댄 너는 나의 그늘이 좋대 어둠이 내리고 모두 떠나가도 가깝지 않은 곳 어디에서 너는 나의 믿음이 되어 미운 말을 쏟아내 상처 주긴 쉬운데 넌 왜 아직 거기 서 있는데 해는 뜨지 않는데 내게 기댄 너는 나의 그늘이 좋대 아 나의 그늘이 나의 그늘이 아 나의 그늘이 나의 그늘이 ,4344
첸 (CHEN),하고 싶던 말 (Sorry not sorry),2019-04-01,실은 하고 싶던 말 턱까지 차올라도 할 수 없던 말 우리 헤어져 차마 하지 못하고 더욱 날 아프게 만들어 더 이상 어떻게 시간이 해결해주리란 믿음 그 하나로 버텨왔는데 후회해 너 없이 살아볼게 힘들어도 견뎌볼게 네가 없는 하룬 참 낯설겠지만 함께라서 행복했던 시간마저 떠올리기 싫어 난 우연이라도 마주치는 일 없기를 우리 헤어져 조금 더 노력하면 내 맘 다 알아줄 거라고 미련한 기대만 시간이 해결해주지는 않아 애써 붙잡았던 날들 후회해 너 없이 살아볼게 힘들어도 견뎌볼게 네가 없는 하룬 참 낯설겠지만 함께라서 행복했던 시간마저 떠올리기 싫어 난 우연이라도 마주치는 일 없기를 우리 헤어져 처음으로 너에게 말할게 차라리 욕해도 좋아 너의 마음 이해하려 하던 이유가 더는 내게 없어 후회해 너 없이 살아볼게 힘들어도 견뎌볼게 늘 주는 것밖에 모르던 날 위해 할 수 있는 모든 것들 널 위해 내어준 마음 더 이상 미련은 없어 마주치는 일 없기를 바래 이젠 사실 하고 싶던 말 미안해 ,39723
수지,I Love You Boy,2017-10-11,그댈 보기 위해 먼 길을 건너왔네요 힘든 길인걸 알면서도 그저 걸었죠 I fly for you 눈감아도 보이지 않던 내 맘에 니가 다가와 Because i love you boy 내 곁으로 다가와요 Because i need you boy 꿈에서도 그리운걸 Remember i love you boy 다신 볼 수 없다 해도 Because i love you boy Because i love you boy 사랑해요 사랑해요 너와 함께한 기억들이 바람에 날려 지친 내 맘에 내려앉아 나를 웃게 해 안개 속을 헤메이던 전하지 못한 내 맘이 네게 다가가 Because i love you boy 내 곁으로 다가와요 Because i need you boy 꿈에서도 그리운걸 내 차가운 맘을 움직였던 가슴을 울게 했던 그 사람이 그댄걸요 정말 잊으려고 해도 지워내려 해도 내 사랑은 그대죠 I fly for you Because i love you boy 내 곁으로 다가와요 Because i need you boy 꿈에서도 그리운걸 Remember i love you boy 다신 볼 수 없다 해도 Because i love you boy Because i love you boy 사랑해요 사랑해요 ,33264
훈스 (HOONS),내가 싫어진 거 알아,2017-02-22,사랑해 말을 해봐도 아무런 대답이 없고 시간을 함께 보내도 더 이상 웃지를 않고 내가 싫어진 거 알아 왜 내가 싫어 왜 내가 싫어 이렇게 나 버려지는 게 싫어 왜 내가 싫어 왜 내가 싫어 이렇게 나 버려지는 게 싫어 아무리 노력을 해도 너에게 우리는 없고 내가 싫어진 거 알아 왜 내가 싫어 왜 내가 싫어 이렇게 나 버려지는 게 싫어 왜 내가 싫어 왜 내가 싫어 이렇게 나 버려지는 게 싫어 ,1339
Sondia,Moonlight,2019-12-31,Moonlight 나를 감싸안아 데려다줘 그럼 너의 온기를 간직하겠어 내가 어디에 숨어있든 다시 날 찾아줘 보기좋게 비껴나온 날 너의 빛으로 비춰줘 내 모든 발자욱과 내 창문 밖에 남은 너와 나의 흔적들 내 모든 것들이 다 그대로 남아 다시 날 채우네 Moonlight 내가 힘이 들 때 찾아와줘 그럼 네 빛을 따라 걸어가겠어 내가 어디에 숨어있든 다시 날 찾아줘 보기좋게 비껴나온 날 너의 빛으로 비춰줘 내 모든 발자욱과 내 창문 밖에 남은 너와 나의 흔적들 내 모든 것들이 다 그대로 남아 다시 날 채우네 ,4461
박새별,사랑이 우릴 다시 만나게 한다면,2013-05-28,사랑이 우릴 다시 만나게 해준다면 나 그대에게 해주고 싶은 말이 너무 많아요 그댈 보내고 내가 얼마나 많은 밤들을 혼자 그리워하는지 그댄 그댄 모르죠 사랑이 우릴 다시 만나게 해준다면 나 그땐 좀 더 온전히 그대를 사랑할게요 어렸었던 우리 지난 날 엇갈림 속에 수많은 차가운 말들로 서롤 얼마나 아프게 했는지 혹시 날 사랑하나요 혹시 날 미워하고 있나요 내게 말해줘요 더 이상 난 아무런 의미 없을까 겁이 나요 사랑이 우릴 다시 만나게 해준다면 긴 시간 너머 언젠가 그대 보일 때까지 내가 기다릴게요 아직까지 선명히 기억나는 풍경 하나 내 머릴 쓰다듬던 익숙한 손길 이별을 말하던 그대 혹시 날 사랑하나요 혹시 날 미워하고 있나요 나 없는 하루가 그댄 아무렇지 않나요 잘 지내지 말아요 어디에 있나요 그대 지금도 난 이렇게 그대가 보고 싶은데 혹시 날 사랑하긴 했나요 혹시 그대도 날 사랑한다면 내가 기다릴게요 언젠가 그대 내게 다시 돌아올 수 있다면 사랑이 우릴 다시 만나게 한다면 ,12564
폴킴,사랑 알 수 없나봐,2018-12-16,사랑 알 수 없나 봐 어떤 마음인지 자꾸 의심하게 돼 청개구리처럼 반대로 하게 되는 게 영리한 건지 어리석은 건지 나 할 수 없나 봐 풀어보려 할수록 더 엉켜버리는 머리론 알겠는데 내 마음은 그게 잘 안돼 그게 잘 안돼 널 보낼 수가 없어 내게 짓던 네 웃음 나를 잡았던 손길 아직 선명해 나 후회해 그땐 왜 그랬는지 눈을 감아도 네 모습 사라지지를 않아 지우고 싶지 않아 정말 미안해 오 미안해 내가 잘못했어 돌아와 사랑 알 수 없나 봐 나를 다독이는 너의 손길 때문에 떠나려 하잖아 아무 말 하지 마 무섭단 말야 아무 말 하지 마 아직 널 보낼 수가 없어 투덜대던 네 입술 눈으로 나눈 사랑 아직 선명해 나 후회해 그땐 왜 그랬는지 하루 온종일 네 모습 사라지지를 않아 지우고 싶지 않아 정말 미안해 오 미안해 내가 잘못했어 돌아와 혹시 돌아올지도 몰라 그래 분명히 너도 내가 그리울 거야 사랑하지만 헤어질 수 있다는 그 거짓말 아직 지키지 못한 약속 내겐 너무 많은데 다 해줄 수 있는데 다시 만나면 꼭 말할게 우리 함께하자 영원히 ,41914
길구봉구,"다시, 우리",2018-05-24,뚜루루 온종일 비가 내렸지 눅눅히 젖은 신발을 보다가 엉겨 붙어버린 기억의 먼지 한 줌이 빗물에 씻겨지질 않네 아무리 우산을 써봐도 내 맘은 젖어만 가 다시 널 불러 사랑했던 그때로 가슴이 아파 넌 들을 수도 없잖아 너 다시 돌아오라고 네가 보고 싶다고 노래해 내게로 와 다시 우리 다시 푸르른 하늘이 오랜만이라 널려있었던 옷을 주워담다가 오 너의 흔적들이 아직도 여기저기에 온기로 남아 있었구나 빨래를 돌려 바래버린 때를 지운들 그때가 지워질까 다시 널 불러 사랑했던 그때로 가슴이 아파 넌 들을 수도 없잖아 너 다시 돌아오라고 네가 보고 싶다고 노래해 내게로 와 다시 우리 다시 그대 두고 간 베갠 젖어 있고 네 칫솔은 내 맘처럼 말라가 하나씩 버리고 흔적을 지워 봐도 내 맘은 너를 쳐낼 수가 없는걸 시간을 돌려 사랑했던 그때로 가슴이 아파 너 다시 돌아오라고 네가 보고 싶다고 노래해 내게로 와 너를 기다려 네가 그리워 돌아와 ,33582
소유 (SOYOU),길에서 (Feat. 적재),2019-12-23,하루 종일 비가 와서 니 얼굴이 또 생각 나 눈물이 났어 한 걸음 더 걸어가면 잊혀질까 봐 비를 맞으며 서 있었어 차갑게 젖어 버린 내 가슴 안에서 아직도 아직도 널 부르잖아 이 길에서 널 만날 수 있다면 그 날처럼 널 보내지 않을 거야 눈물이 멈춘대도 너를 지울 수는 없을 것 같아 너 올까봐 어느새 그친 빗줄기에 니 모습도 사라졌어 보이지 않아 한번만 더 한번만 더 보고 싶어서 마른 하늘에 널 그렸어 차갑게 식어 버린 내 목소리 마저 아직도 이렇게 널 부르잖아 이 길에서 널 만날 수 있다면 그 날처럼 널 보내지 않을 거야 눈물이 멈춘대도 너를 지울 수는 없을 것 같아 니가 다시 올까봐 기다릴게 나 여기 서 있을게 늦기 전에 지금 내게 돌아와줘 이 길에서 널 만날 수 있다면 그 날처럼 널 보내지 않을 거야 눈물이 멈춘대도 너를 지울 수는 없을 것 같아 꼭 돌아와 날 안아줘 ,5946
헤이즈 (Heize),내 맘을 볼 수 있나요,2019-07-28,내 맘을 볼 수 있나요 난 그대뿐이에요 그대 뒤에 나 있을게요 한걸음 뒤에서요 그댄 내 마음 모르죠 눈물이 글썽여요 그댈 보면 마음이 아프네요 혼자 하는 사랑은 언젠가 다시 돌아가야 할 그곳을 홀로 걸어가겠죠 그런 내가 슬퍼요 모른척 하는 건가요 그대 곁에 있는 날 힘껏 소리쳐 불러봐도 마음의 소리니까 언젠가 다시 돌아가야 할 그곳을 홀로 걸어가겠죠 그런 내가 슬퍼요 언젠가 다시 돌아가야 할 그곳을 홀로 걸어 돌아가겠죠 이런 내가 아파요 우우우우우 슬픈 마음이 들어요 나는 왜 안되는지 사랑이란 가깝고도 머네요 그대의 마음이란 ,100700
윤현상,잊는다는 게,2015-03-13,잊는다는 게 참 그래요 사랑하다가 이별하게 되면 그때서야 못해줬던 게 생각이 나요 꼭 어제 일처럼 추억이란 게 참 그래요 분명 내 맘속엔 아직 남아있는데 지나가면 없었던 일로 해버리는 게 속 편할 때가 있겠죠 잊는다는 게 왜 이리 힘들죠 함께했었던 그 시간 때문일까요 새로운 사람을 만나서 행복해지면 되는 간단한 일인데 왜 그리 어렵죠 잊는다는 게 이별이란 게 참 그래요 지키지 못한 약속들이 전부 내게 거짓말이 돼 버린단 게 내가 이기적인 게 돼버리니까 잊는다는 게 왜 이리 힘들죠 함께했었던 그 시간 때문일까요 새로운 사람을 만나서 행복해지면 되는 간단한 일인데 왜 그리 어렵죠 잊는다는 게 지금 생각나는 모든 것들이 어쩌면 다시는 또 오지 못할 기억에 묻힌 날들 행복했었던 날들 이젠 잊어야겠지 모두 잊어야겠지 가끔 생각이 날 때가 있겠죠 그댈 만나서 그 동안 행복했어요 새로운 사람을 만나도 그댄 잊지 말아요 이제는 끝인 게 왜 그리 어렵죠 왜 그리 힘들죠 잊는다는 게 ,29999
T.P RETRO (타디스 프로젝트舊),오늘도 그대만 (Feat. 정동원),2017-02-28,봄날처럼 몰래 다가왔던 나의 그대 여름 같이 뜨거웠던 우리의 시간들 어느덧 찾아온 시린 겨울 혹시 그대 아프진 않을까 걱정돼요 그대에게 부족한 나라서 나 그렇게 그댈 붙잡지 못했죠 소리 없이 울먹이던 그대 그만하자는 그 말 다 거짓말이죠 오지 않는 전화를 붙잡고 후회만 하는 참 바보 같은 나 그땐 뭐가 그렇게 어려웠던 건지 조용히 그대 마음 안아줄 걸 우연처럼 다시 와줘요 내 품에 머물던 그대 온기 남았는데 그댈 사랑한 만큼 하루하루 겨우 버텨봐도 너무 아파 매일 그대 생각에 살아요 빗방울이 떨어지던 그 밤 우산처럼 기울던 그대와 나는 하염없이 눈물만 흘렸죠 돌아온다는 그 말 다 거짓말이죠 오지 않는 전화를 붙잡고 후회만 하고 있는 참 바보 같은 내가 그댈 사랑한 만큼 하루하루 겨우 버텨봐도 너무 아파 매일 그대 생각에 살아요 오늘도 술에 취해 그댈 부르고 후회만 하고 있는 참 이기적인 내가 우리 사랑한 만큼 지우기엔 너무 아픈 그대 이름 매일 그대 생각에 울어요 다시 내게 와줘요 ,101735
아이유,밤편지,2017-03-24,이 밤 그날의 반딧불을 당신의 창 가까이 보낼게요 음 사랑한다는 말이에요 나 우리의 첫 입맞춤을 떠올려 그럼 언제든 눈을 감고 음 가장 먼 곳으로 가요 난 파도가 머물던 모래 위에 적힌 글씨처럼 그대가 멀리 사라져 버릴 것 같아 늘 그리워 그리워 여기 내 마음속에 모든 말을 다 꺼내어 줄 순 없지만 사랑한다는 말이에요 어떻게 나에게 그대란 행운이 온 걸까 지금 우리 함께 있다면 아 얼마나 좋을까요 난 파도가 머물던 모래 위에 적힌 글씨처럼 그대가 멀리 사라져 버릴 것 같아 또 그리워 더 그리워 나의 일기장 안에 모든 말을 다 꺼내어 줄 순 없지만 사랑한다는 말 이 밤 그날의 반딧불을 당신의 창 가까이 띄울게요 음 좋은 꿈 이길 바라요 ,445569
곽진언,택시를 타고,2016-05-10,날이 참 좋길래 아무거나 걸쳐 입고 밖에 나와서 택시를 타고 아무데나 가달라고 했어 어디로 가든지 어디로 가든지 너를 다 두고 오려고 너를 다 두고 오려고 빠르게 지나가는 창밖의 풍경처럼 우리도 사라진다면 얼마나 좋을까 택시를 타고 아무데나 가달라고 했어 널 두고 오려고 널 두고 오려고 빠르게 지나가는 창밖의 풍경처럼 우리도 사라진다면 얼마나 좋을까 택시를 타고 아무 데나 가달라고 했어 널 두고 오려고 널 두고 오려고 날이 참 좋길래 아무거나 걸쳐 입고 밖에 나와서 ,6794
윤종신,말꼬리,2011-05-31,비는 오고 너는 가려 하고 내 마음 눅눅하게 잠기고 낡은 흑백영화 한 장면처럼 내 말은 자꾸 끊기고 사랑한 만큼 힘들었다고 사랑하기에 날 보낸다고 말도 안 되는 그 이별 핑계에  나의 대답을 원하니 너만큼 사랑하지 않았었나봐 나는 좀 덜 사랑해서  널 못 보내  가슴이 너무 좁아 떠나간 너의 행복 빌어줄  그런 드라마 같은  그런 속 깊은 사랑  내겐 없으니 사랑하면 내게 머물러줘 사랑하면 이별은 없는거야 너만큼 사랑하지 않았었나봐 나는 좀 덜 사랑해서  널 못 보내  가슴이 너무 좁아 떠나간 너의 행복 빌어줄  그런 드라마 같은  그런 속 깊은 사랑  내겐 없으니 우리의 사랑 바닥 보일 때까지 우리의 사랑  메말라 갈라질 때까지  다 쓰고 가 남은 사랑처럼 쓸모 없는 건  만들지 마요  손톱만큼의 작은 사랑도  내게 다 주고 가요 그러니까 이별은 없는거야 ,46043
정승환,숲으로 걷는다,2016-11-29,숲으로 걷는다 미안하단 말 대신 천천히 걷는다 기억의 너와 나란히 걷는다 아무 말 못하고 쳐다만 보는 널 뒤로 한 채 정신 없이 도망치는 철없던 내가 또 떠올라서 지우고 지워도 변한 게 없는 그때의 내 모습 숲으로 걷는다 내 빈 가슴을 채운다 천천히 걷는다 추억의 길을 혼자서 걷는다 이제 다 끝났어 혼자서 그렇게 말해본다 시간 속을 되 돌아가 달려가 꿈처럼 널 안고 싶지만 알아 너도 이제 다 잊었겠지 모든 게 변했지 숲으로 걷는다 보고 싶단 말 대신 천천히 걷는다 기억의 너와 나란히 걷는다 잊혀진 널 다시 만나러 ,7894
문빛,끝자락,2017-11-02,다 알고 있었어 저 별이 지고 나면 말이야 애써 아무렇지 않은 척 또 난 예전 같진 않았어 보고 싶다는 너의 말이 내가 알던 네 모습이 낯설게 느껴져 하루만 더 또 하루만 더 혹시나 한번 오늘 어쩌면 아무 말도 할 수 없었어 멈춰진 너의 오늘은 더 이상 내가 노력해도 변하지 않을 걸 알아 멀어지는 너의 손을 내가 잡아도 될까 네가 없이 견딜 수 있을까 예전 같진 않았어 사랑한다는 너의 말이 내가 알던 네 모습이 낯설게 느껴져 하루만 더 또 하루만 더 혹시나 한번 오늘 어쩌면 네가 돌아와 주길 아무 말도 할 수 없었어 멈춰진 너의 오늘은 더 이상 내가 노력해도 변하지 않을 걸 알아 멀어지는 너의 손을 내가 잡아도 될까 네가 없이 견딜 수 있을까 이제 와서 뭘 어떻게 할 수 있을까 미뤄둔 그 말을 오늘은 해야 할까 말할 수 있을까 아무 말도 할 수 없었어 남겨진 나의 내일은 더 이상 내가 노력해도 변하지 않을 걸 알아 멀어지는 너의 손을 내가 잡아도 될까 네가 없이 견딜 수 있을까 ,1773
박효신,숨,2016-10-03,오늘 하루 쉴 숨이 오늘 하루 쉴 곳이 오늘만큼 이렇게 또 한번 살아가 침대 밑에 놓아둔 지난 밤에 꾼 꿈이 지친 맘을 덮으며 눈을 감는다 괜찮아 남들과는 조금은 다른 모양 속에 나 홀로 잠들어 다시 오는 아침에 눈을 뜨면 웃고프다 오늘 같은 밤 이대로 머물러도 될 꿈이라면 바랄 수 없는걸 바라도 된다면 두렵지 않다면 너처럼 오늘 같은 날 마른 줄 알았던 오래된 눈물이 흐르면 잠들지 않는 내 작은 가슴이 숨을 쉰다 끝도 없이 먼 하늘 날아가는 새처럼 뒤돌아 보지 않을래 이 길 너머 어딘가 봄이 힘없이 멈춰있던 세상에 비가 내리고 다시 자라난 오늘 그 하루를 살아 오늘 같은 밤 이대로 머물러도 될 꿈이라면 바랄 수 없는걸 바라도 된다면 두렵지 않다면 너처럼 오늘 같은 날 마른 줄 알았던 오래된 눈물이 흐르면 잠들지 않는 이 어린 가슴이 숨을 쉰다 고단했던 내 하루가 숨을 쉰다 ,222821
AKMU (악뮤),작별 인사,2019-09-25,떠날 때 창틀에 화분이 비었길래 뒤 뜰의 꽃을 옮겨 담았어요 제라늄 꽃을 떠날 때 책장에 먼지가 쌓였길래 책 하나 속에 꽂아두었어요 짧은 편지를 정든 찻잔도 색이 바랜 벽지도 흔적이 힘들어서 바꾸지 말아요 내 마음에도 같은 것들을 남긴 것처럼 떠날 때 문턱에 나비가 앉았길래 넘지 못하고 바라보았어요 떠날 때 발등에 개미가 올랐길래 걸음 멈추고 나누었어요 작별 인사를 정든 찻잔도 물기 배인 마루도 의미를 알기 전에 바꾸지 말아요 내 마음에도 같은 것들을 남긴 것처럼 ,29073
드림캐쳐,괜찮아!,2017-07-27,아직도 난 길을 잃어서 어디로 갈지 몰라 조금도 나아지지가 않아 사실은 나 아직 어려서 모르겠어 지금도 어디쯤에 와있지 창 밖을 보니 날씨가 또 어두워진 탓에 괜히 생각이 더 많은 밤 저기 멀리 멀리 있는 곳에 조금씩 들려오는 느껴지는 빗소리 눈을 감고 나에게 말해줘 괜찮아 괜찮아 이렇게 So trust me 지치고 힘이 들 때면 마음은 답답해지고 쉽게 되는 건 또 하나 없는 것 같아 Oh 오랜만이야 나 여기 쉬었다 가 항상 바빴잖아 가끔씩은 숨을 돌려도 괜찮아 나가기도 싫은 날이야 그냥 내 방에 누워 창 밖을 보니 유난히 조용해진 골목 탓에 괜히 생각에 더 잠긴 밤 저기 멀리 멀리 있는 곳에 조금씩 들려오는 느껴지는 빗소리 눈을 감고 나에게 말해줘 괜찮아 괜찮아 이렇게 더 많이 웃을게 행복한 나를 지켜주고 싶어 저기 멀리 멀리 있는 곳에 조금씩 들려오는 느껴지는 빗소리 눈을 감고 나에게 말해줘 괜찮아 괜찮아 이렇게 So trust me ,4281
박효신,Beautiful Tomorrow,2016-10-03,그려지지 않아 눈을 감고 있어도 그렇게나 사랑하고 사랑했었던 너를 너를 몇 번이고 몇 번이든 꿈이었다면 또 한번 원망하고 미워한 내가 미안하고 또 미안해 Because of you 난 아직도 Because of you 너무 아파 무덤덤히 걸어가다 발걸음 마다 울고 울다 다 젖어버린 눈을 감아 Because of you 그 동안 행복했어 나도 너만큼 이제야 후회가 돼 그 누구보다 날 사랑할 수 있는 건 너야 Because of you 난 오늘도 Because of you 겨우 살아 추억 속을 걸어가다 발걸음 마다 웃고 웃다 다 젖어버린 눈을 감아 Because of you 난 괜찮아 Because of you 어느 날 우리 만나면 예전처럼 내가 아무 말 없이 웃어보일게 Because of you Because of you 그래 너는 나였었고 바라만 봐도 눈물 나는 넌 나의 영원한 너란 걸 Beautiful Tomorrow 그 날 그대로 여기 남아 있을게 여기 Because of you ,58852
