가수명,노래제목,발매일,가사,좋아요수,순위
양다일,요즘,2020-12-29,해가 질 때쯤에 눈을 뜨고 나면 다가오는 어둠 속에 나만 홀로 깨어 있는 듯해 고요한 거리를 하염없이 걷다 보면 외로움이 찾아와 어느새 깊어진 새벽에 잠든 추억을 꺼내 함께 나눈 감정들 그 안을 헤집어 바라보면 아련해진 기억에 혼자 남은 쓸쓸함에 아쉬움마저도 느낄 수가 없는 내 모습이 설렘 가득했던 그 순간의 내가 생각이 나질 않아 후회로 가득한 우리 마지막도 이제는 아쉽지가 않아서 한참을 떠올려도 모든 게 자꾸 무뎌진 요즘 익숙해진 건지 그새 편해진 건지 세상이 무너진 듯 견딜 수 없어 힘들었는데 흘러간 시간인지 외면해 버린 건지 더는 이상할 만큼 아무렇지 않은 이 기분이 설렘 가득했던 그 순간의 내가 생각이 나질 않아 후회로 가득한 우리 마지막도 이제는 아쉽지가 않아서 한참을 떠올려도 모든 게 자꾸 무뎌진 요즘 가끔은 이런 내 모습이 너무 낯설어서 두려워질 때면 널 만나 울고 웃던 시간으로 다시 돌아간다면 찾아오는 감정들에 우리 둘이 전부였던 그 세상에서 잃어버린 날 찾을 수 있을까 사랑한다는 게 헤어진다는 게 더는 아쉽지 않아 누구를 만나도 너와 함께했던 그때의 내가 아닌 것 같아 어쩌면 이 모든 게 널 떠올리는 이유인 것 같아 설렘 가득했던 그 순간의 내가 생각이 나질 않아 후회로 가득한 우리 마지막도 이제는 아쉽지가 않아서 한참을 떠올려도 모든 게 자꾸 무뎌진 요즘 ,24174,618
김종국,"별, 바람, 햇살 그리고 사랑",2005-07-01,눈이 부시도록 투명한 아침 싱그러운 햇살속에 잠든 너의 숨결위로 묻어나는 행복 별이되어 바람이 되어 추억에 잠기면 어느 새 잠에서 깨어 날 부르며 웃는 너 baby never say goodbye 단 한사람 너만 있어주면돼 이세상 무엇도 널 대신 할순없어 baby don't you never cry 아름다워 네가 있는 이 세상 사랑하기에 나는 행복하니까 내몸 가득 배인 너의 향기와 입술 가득 고인 미소 여기 이 모든 행복이 정말 내 것인지 사라질까 잃어버릴까 두려운 마음에 살며시 너를 안고서 저 하늘에 기도해 baby never say goodbye 단 한 사람 너만 있어주면돼 이세상 무엇도 널 대신 할순없어 baby don't you never cry 아름다워 네가 있는 이세상 사랑하기에 나는 행복하니까 구름속의 연인들처럼 늘 함께있어도 이렇게 안고 있어도 더 그리워지는 너 baby never say goodbye 단 한사람 너만 있어주면돼 이세상 무엇도 널 대신 할 순 없어 baby don't you never cry 아름다워 네가 있는 이세상 사랑하기에 나는 행복하니까 영원히 지금 이대로 워우워 너만을 사랑하겠어 워우워 ,27796,619
박효신,사랑한 후에,2012-03-22,나의 기억 어딘가에 동그마니 숨어 있다 울컥 쏟아져 내려오는 너 기나긴 하루 한 번쯤 너도 나의 모습 떠오르는지 사랑이라 부르기엔 우린 너무 멀어졌고 차마 잊기엔 아직은 너무 일러 오늘도 난 사랑과 이별 사이를 눈물로 맴돌며 숨차게 너를 찾고 있어 바보야 어딨니 안 가면 안되니 너를 보낸 그곳에 아직도 난 서 있는데 머리에 가슴에 그 모습이 그리워서 또 한 번 숨죽여 운다 널 사랑한 후에 오랜만에 문을 나서 바깥바람을 만지다 덜컥 다가선 외로움에 무너져 네 손에 끌려 다니던 정들은 거리 너 없는 슬픔에 잰걸음으로 집으로 가 바보야 어딨니 안 가면 안되니 너를 보낸 그곳에 아직도 난 서 있는데 머리에 가슴에 그 모습이 그리워서 또 한 번 숨죽여 운다 널 사랑한 후에 널 불러보다가 뒤돌아 보면 그곳엔 널 닮은 추억만이 넌 아니 모르니 알면서 그러니 여태 잊지 못하고 아직 널 기다리는데 어떤 날 올 거니 내 심장이 멈출까 봐 또 다시 그리워 운다 널 사랑한 후에 ,79057,620
먼데이 키즈 (Monday Kiz),이런 남자,2008-09-04,못볼 것 같아서 그럴 자신 없어서 내 눈에 너를 새겨 두려고 널 보고만 있어 이렇게라도 내 맘에 두고두고 꺼내보려고 네게 줄 반지만 자꾸 매만지는걸 그래도 널 위해 준비했는데 말하지 못하는 바보 같은 내 맘과 같은걸 흔한 인사조차 네게 건내지 못하는 나 이런 남자이니까 네게 눈물 보일까봐서 맘에 없는 괜찮다는 말만 내내 되풀이하는 이런 나이니까 돌아서며 눈물 흘리는 사랑해도 사랑한다는 그 말하나 못한 바보이니까 내 눈에 남아서 너로 가득 채워서 세상엔 너밖에 보이지 않아 행복하란 말 좋은 사람 만나 잊으란 말 너의 그 한마디 그저 웃고만 있는 난 나 이런 남자이니까 네게 눈물 보일까봐서 맘에 없는 괜찮다는 말만 내내 되풀이하는 이런 나이니까 돌아서며 눈물 흘리는 사랑해도 사랑한다는 그 말하나 못한 바보이니까 널 사랑하기엔 많이 모자랐나봐 어쩔수 없나봐 no no 떠나가는 뒷모습만 내 맘속에 간직할게 그래도 나 조금은 기억해줘 oh yeah 나 그런 남자였다고 한때 너를 지켜준 사람 가끔씩은 생각나는 사람 그런 남자이면 돼 참 바보였다고 돌아서며 눈물 흘리는 사랑해도 사랑한다는 그 말하나 못한 바보였다고 ooh 너만 사랑하는 바보이니까 ,31404,621
V.One,그런가 봐요...,2003-01-19,고맙다는 그 말 잘 못하는 사람 미안할 땐 괜히 더 화내는 사람 통화하다 먼저 끊는 사람 지난 사랑 얘길 늘 하는 사람 미리 해둔 약속 잘 어기는 사람 했던 얘기를 또 물어보는 사람 괜찮다고 걱정 말라하면 그 말 믿는 사람 그게 나래요 그녀가 말했죠 여자를 떠나게 만드는 남자들을 아냐고 그 이유 다 갖춘사람 오 다 나래요 그래서 날 떠나갔죠 그녀는 모르죠 나 얼마나 그녈 많이 사랑한지 그녈 위해선 아마 더한 버릇도 내가 다 고쳤을 텐데 그녀는 모르죠 내 모자란 자존심에 말 못했던 수많은 얘기 눈으로만 말한 걸 아마 듣지도 못하고 가나봐요 말하지 않아도 내 맘 아는 사람 약속에 늦어도 웃어주던 사람 작은 선물 뜻 없이 건네도 좋아하던 사람 그게 그녀죠 그녀는 말했죠 이별한 후에 더 차가운 여자 맘을 아냐고 만날 때 후회 없었던 오 그 이유라 미련조차 없다했죠 그녀가 떠났죠 이렇게 날 미련 속에 남겨두고 미안한 일이 너무 나도 많아서 후회뿐인 나를 두고 그녀는 떠났죠 다른 사랑 이래서는 안 된다며 내 마지막은 그녀였단 얘기를 끝내 듣고도 모른체 가나봐요 그녀는 모르죠 나 얼마나 그녈 많이 사랑한지 그녈 위해선 아마 더한 버릇도 내가 다 고쳤을 텐데 그녀는 모르죠 내 모자란 자존심에 말 못했던 수많은 얘기 눈으로만 말한 걸 아마 듣지도 못하고 가나봐요 나의 사랑이 날 두고 떠나가요  ,52918,622
유미,사랑은 언제나 목마르다,2002-02-05,그렇게 많이 사랑한다 했는데 이제야 사랑을 알것 같아요 부탁이 있어 제발 용서 마세요 오늘 난 당신을 버리려고해 제발 얼굴을 들어봐요 나를 위해서 참아왔던 아픔 사랑으로 나를 잡아줘요 단 하나의 그 하나로 사랑하고 싶었던 그 아픈 약속과 눈물들이 가슴 속 멍으로 남겠지만 날 떠나요 이젠 돌아 오지 못할 거에요 난 사랑에 목이 마르겠지요 그대는 항상 미안하다고 했죠 지금도 눈물을 참고 있나요 나를 위해 울지 마세요 나를 사랑하며 참아온 모든 이 상처를 오늘 다 버려요 단 하나의 그 하나로 사랑한다 했었던 그대의 약속과 눈물들이 다시 또 나를 울리겠지만 괜찮아요 날 위해 슬퍼하지 마세요 이제 나를 사랑하지마요 오직 하나의 그 하나로 사랑하자 했었던 우리의 약속과 추억들이 가슴 속 상처로 남을거야 날 떠나요 이제 돌아오지 못할거에요 난 사랑에 목이 마르겠지요 ,44221,623
이석훈,사랑하지 말아요 (Prod. 로코베리),2019-01-24,거리마다 그대 추억들이 많아서 보란듯이 애써 웃어보려 하지만 겨울의 눈꽃이 피어나듯 그대 다시 생각이나 이렇게 눈물이나 서리낀 창문에 그대 얼굴 그리면 그때서야 떠오르는 나는 상처투성이 언제쯤이면 그댈 잊고서 웃을 수 있나 아마 그건 힘들지 몰라 그대 나를 사랑하지 말아요 내 맘에 다시 들어오지 말아요 잠시 눈물아 안녕 나를 돌아보지마 내게서 제발 달아나줘요 찬바람 불어와 그대 소식 전해도 아무렇지 않은 듯이 웃어넘길 수 있길 언제쯤이면 그대 뒷모습 잊을 수 있나 아마 그건 안될지 몰라 그대 나를 사랑하지 말아요 내 맘에 다시 들어오지 말아요 잠시 눈물아 안녕 나를 돌아보지마 내게서 제발 달아나 계절의 끝에 서 있는 추억은 이제는 보내야만 하겠지 나의 사랑아 그대 나를 떠나가지 말아요 내 가슴이 그대를 붙잡아요 달라져 버린 시간 돌릴 수는 없겠죠 그대를 정말 사랑했어요 ,39372,624
노아주다 (noahjooda),"힙합보단 사랑, 사랑보단 돈 (Feat. 베이식)",2022-03-13,그녀를 처음 만난 건 작은 클럽 공연장에서 나는 공연 중이었고 그녀는 빵댕일 흔들었어 난 힙합스웩을 뽐내며 그녀에게 다가가서 돈가스 좋아해요 라고 물었고 우린 돈가스 썰러 갔어 그렇게 우리 사랑이 바삭바삭 튀겨지다가도 다시 눅눅해져 버릴 즘 우린 이별했다고 힙합보단 사랑 사랑보단 돈 내가 거지라 그녀가 떠났고 나 눈물이 안 나 심장이 없나 봐 그래 난 돈이나 벌래 돈이 많음 하나도 안 외로워 돈이 많음 하나도 안 서러워 이 말이 다 맞아 이 말조차 틀리다 하면 나 어떻게 살아 힙합은 너무나 어려워 사랑은 훨씬 더 어려워 돈이 많으면 안 어려워 돈이 없어 마음이 아려와 돈이 많으면 좋겠어 돈이 많으면 좋겠어 돈이 많으면 좋겠어 돈이 많으면 좋겠어 힙합은 너무나 어려워 사랑은 훨씬 더 어려워 돈이 많으면 안 어려워 돈이 없어 마음이 아려와 돈이 많으면 좋겠어 돈이 많으면 좋겠어 돈이 많으면 좋겠어 돈이 많으면 힙합보단 사랑 사랑보단 돈 내가 거지라 그녀가 떠났고 나 눈물이 안 나 심장이 없나 봐 그래 난 돈이나 벌래 돈이 많음 하나도 안 외로워 돈이 많음 하나도 안 서러워 이 말이 다 맞아 이 말조차 틀리다 하면 나 어떻게 살아 나 어떻게 살아야 하나요 복잡한 눈물이 흐르네요 솔직히 말하면 난 아직 그녀를 못 잊었다고 힙합을 절대 못 놓겠다고 말하더니 들고 온 게 도토리 싸이 감성 노래나 부르고 앉았네 이 새끼 이건 좀 아닌 듯 멀리 갔어 사장이란 놈이 장르의 경계의 무너짐을 얘기한 뒤 어 사랑타령 있니 상식 어 감미로운데 생긴 건 장비 어 나이 먹어서 요즘 감성을 모르겠다지만 이 새끼도 스물 막바지 꼰대와 요즘 애들 사이에서 혼란스러운데 킹 받게 하는 것도 갖가지 증명해라 니가 fake one 인지 근데 가이드 첨 받고 나서부터 계속 흥얼거려 멘붕 근데 이게 대박 나면 개꿀 많은 시간 지나도 나는 후회 안 할 걸 알고 있어 내 진심을 담아서 노랠 만들었는데 한 번 들어봐줄래 힙합보단 사랑 사랑보단 돈 내가 거지라 그녀가 떠났고 나 눈물이 안 나 심장이 없나 봐 그래 난 돈이나 벌래 돈이 많음 하나도 안 외로워 돈이 많음 하나도 안 서러워 이 말이 다 맞아 이 말조차 틀리다 하면 나 어떻게 살아 ,5270,625
백예린 (Yerin Baek),한계,2021-09-10,내가 원하는 나의 모습과 네가 필요로 하는 나의 모습이 같지가 않다는 것 잘못된 건 아니지 않나요 미안할 일 아니지 않나요 그런데 왜 또 그렇게 자꾸 날 몰아세우는 건데 도대체 뭐를 더 어떻게 해  난 몇 마디의 말과 몇 번의 손짓에 또 몇 개의 표정과 흐르는 마음에 울고 웃는 그런 나약한 인간일 뿐인데 대체 내게서 뭐를 더 바라나요 내가 줄 수 있는 것 그 이상을 줄 수 없음에 미안해해야 하는 건 이제 그만둘래요  달라졌구나 참 많이도 변했구나 난 여전히 그대론데 넌 달라져 버렸어 근데 혹시 한 번쯤 반대로 생각해 본 적은 없었나요 난 몇 마디의 말과 몇 번의 손짓에 또 몇 개의 표정과 흐르는 마음에 울고 웃는 그런 나약한 인간일 뿐인데 대체 내게서 뭐를 더 바라나요 내가 줄 수 있는 것 그 이상을 줄 수 없음에 미안해해야 하는 건 이제 그만둘래요  빼곡히 들어선 의미라 했지만 나에겐 공허하기만 한 일방성의 무의미함 방랑과 방황의 차이  난 몇 마디의 말과 몇 번의 손짓에 또 몇 개의 표정과 흐르는 마음에 울고 웃는 그런 나약한 인간일 뿐인데 대체 내게서 뭐를 더 바라나요 내가 줄 수 있는 것 그 이상을 줄 수 없음에 미안해해야 하는 건 이제 그만둘래요,40907,626
린,My Destiny,2013-12-26,나 다시 허락한다면 그댈 다시 볼 수 있다면 내 지난 기억 속에서 그 아픔 속에서 그댈 불러 You`re my destiny 그댄 You`re my destiny 그댄 You`re my everything 그대만 보면서 이렇게 소리없이 불러봅니다 You`re the one my love 그댄 You`re the one my love 그댄 You`re my delight of all 그대는 영원한 나의 사랑이죠 내 곁에 다가와 줘요 날 아직 사랑한다면 두 눈에 고인 눈물이 그대를 원하죠 사랑해요 You`re my destiny 그댄 You`re my destiny 그댄 You`re my everything 변하지 않는건 그대를 향한 나의 사랑입니다 You`re the one my love 그댄 You`re the one my love 그댄 You`re my delight of all 세상이 변해도 그대만 사랑하는 나를 아나요 My Destiny 그대를 불러봅니다 ,71759,627
더 넛츠 (The NuTs),잔소리,2006-12-18,아무일 없지 지낼만 하지 거 봐 괜찮다고 했잖아 장난기 어린 네 맑은 음성이 하루종일 내 곁에 있곤 해  어딜 가든지 내가 무얼 하든지 혼자 내버려 두질 않아 무얼 먹어야 할지 무얼 입어야 할지 가면 갈수록 더해지는 너의 잔소리  그래서 눈물 나 내 귓가에 네가 있는데 너를 볼 수 없다는게 그게 너무 슬퍼서  그래서 눈물 나 내 가슴에 살아 있는 널 너무 보고 싶어서 너무 보고 싶어서 너무 아파  저 여잔 어때 자꾸 등을 떠밀어 다른 여잘 만나게 해도 열 번이면 열 번다 이뤄질 수 없었고 그런 날이면 전쟁 같은 너의 잔소리  그래서 눈물 나 나 그렇게 누굴 만나면 이제 다신 내 귓가에 오지 않을 너라서  그래서 눈물 나 너 그렇게 보내 버리면 니가 보고 싶어서 너무나 보고 싶어서 눈물이 나  어쩜 이렇게 아플까 가슴 터질 것처럼 그저 너 하나 없는 것 일뿐인데  그래서 눈물 나 이 세상이 해준 것 보다 니가 내게 해준 것이 너무 나도 많아서  그래서 눈물 나 널 더 이상 듣지 못한 채 주먹만 한 가슴에 너를 살게 하는 게 미안해서  ,30033,628
빅마마,아무렇지 않은 척,2022-02-10,난 아무렇지 않은 척 똑같은 하루를 보내 이젠 혼자인 게 편하다 농담도 해 너를 잃은 후에야 난 알 것만 같아 네 곁에서 난 행복했어 그래 어쩔 수 없나 봐 사랑은 다 이런가 봐 숨을 쉴 때마다 네가 또 생각나 매일 후회만 했어 네가 없이는 안되겠어 너에게 못해준 게 난 많이 있는데 넌 아무렇지 않은 듯이 살 수 있나 봐 난 아무렇지 않은척해 봐도 죽을 것 같아 못 견디게 그립고 셀 수 없이 보고 싶어 혹시라도 돌아올까 봐 아직도 나는 너만 기다려 난 네가 미워질 만큼 널 사랑하고 있나 봐 하루 종일 너만 그리고 있잖아 이런 나의 마음을 왜 이제야 알게 된 걸까 후회하고 후회하면 돌아와 줄까 넌 아무렇지 않은 듯이 살 수 있나 봐 난 아무렇지 않은척해 봐도 죽을 것 같아 못 견디게 그립고 셀 수 없이 보고 싶어 혹시라도 돌아올까 봐 아직도 나는 너만 기다려 가슴속 깊게 새겨진 너의 이름만 불러보다가 한참을 울었어 언제쯤 널 잊고 살 수 있을까 못 하겠어 너는 지울 수 있나 봐 난 네가 없인 단 하루도 살아갈 수가 없어 내게 돌아와 줘 못 견디게 그립고 셀 수 없이 보고 싶어 혹시라도 돌아올까 봐 아직도 나는 너만 기다려,7910,629
휘인 (Whee In),내 눈물 모아,2020-05-01,창밖으로 하나둘씩 불빛이 꺼질 때쯤이면 하늘에 편지를 써 날 떠나 다른 사람에게 갔던 너를 잊을 수 없으니 내 눈물 모아서 하늘에 너의 사랑이 아니라도 네가 나를 찾으면 너의 곁에 키를 낮춰 눕겠다고 잊혀지지 않으므로 널 그저 사랑하겠다고 그대여 난 기다릴 거예요 내 눈물의 편지 하늘에 닿으면 언젠가 그대 돌아오겠죠 내게로 난 믿을 거예요 눈물 모아 너의 사랑이 아니라도 네가 나를 찾으면 너의 곁에 키를 낮춰 눕겠다고 잊혀지지 않으므로 널 그저 사랑하겠다고 그대여 난 기다릴 거예요 내 눈물의 편지 하늘에 닿으면 언젠가 그대 돌아오겠죠 내게로 그대여 난 기다릴 거예요 내 눈물의 편지 하늘에 닿으면 언젠가 그대 돌아오겠죠 내게로 난 믿을 거예요 눈물 모아 ,58268,630
김범수,사랑의 시작은 고백에서부터,2015-05-23,사랑은 소리 없이 찾아와 내 가슴을 떨리게 만들죠 아무런 이유 없이 전화를 그냥 만져 보는 나를 보네요 두근거리는 맘을 달래고 그대에게 전화를 했지만 들을 수 없었던 그 목소리 오늘 따라 너무 그리워져요 나 오늘 너에게 고백할 거야 사랑한다고 세상에 말할 거야 나 비록 가진 건 하나 없지만 행복을 줄 거야 오직 너 하나면 충분해 사랑은 내게 상처 뿐이라 두 번 다신 하기 싫었는데 널 만난 그 순간 알게 됐어 바보처럼 겁이 많았다는 걸 나 오늘 너에게 고백할 거야 사랑한다고 세상에 말할 거야 나 비록 가진 건 하나 없지만 행복을 줄 거야 오직 너 하나면 충분해 저 밝은 별처럼 지켜줄 거야 어디에 있든 너를 비춰 줄 거야 내 가슴 한 쪽이 사라지는 날 그 때는 말할게 나를 받아 줘서 감사해 사랑하게 해 줘서 고마워 ,72247,631
최유리,바람,2021-09-25,울지 않을래 슬퍼지지 않게 더는 아픈 말 없게 나 이제 사랑한단 맘으로만 가득하게 난 한 치 앞을 봐 우리는 왜 대체 놓여버린 아픔에만 무게를 두려는지 나와는 다른 마음일런지 가난하게 사랑받고만 싶어 깊은 마음에 기뻐하게 가난하게 사랑을 받고만 싶어 나는 난 한 치 앞을 봐 이미 우리는 다 놓여버린 말들에만 무게를 두었기에 아쉬움만 보인 거지 가난하게 사랑받고만 싶어 깊은 마음에 기뻐하게 가난하게 사랑을 받고만 싶어 이게 따분해질 일인가요 내가 그래 너를 바라다볼 때 난 사랑에 목이 말라있어 아픈 말 다 잊을 땐 날 찾아와 ,35899,632
존박,밤새 서로 미루다,2021-12-09,있잖아 문득 중요한 일을 까먹은 듯한 그런 기분 건망증처럼 그래 나도 문득 아직 못다한 얘기가 자꾸 맴돌아 혼잣말처럼 우리 밤새 서로 미루다 끝내 하지 못한 말 그대 모르게 연습했었던 말 뭐가 그렇게 두려웠는지 더 멀어질까 못한 말 지금이라도 전한다면 잊혀지게 될까 널 잊을 수 있을까 이젠 혹시 부담될까 네 안부조차 모르는 게 널 위한 배려라 날 위한 배려라 믿었었나 봐 우리 밤새 서로 미루다 끝내 하지 못한 말 그대 모르게 연습했었던 말 뭐가 그렇게 두려웠는지 더 멀어질까 못한 말 지금이라도 전한다면 잊혀지게 될까 널 잊을 수 있을까 잘 지내도 돼 영영 못 잊어도 돼 또 다신 너를 보낼 수가 없어 밤새 서로 미루다 끝내 하지 못한 말 수백 번 넘게 꾹 삼켰던 그 말 먼저 다가오기를 기다린 어리석었던 우리의 모든 걸 바꿀 수 있었던 하고 싶었던 말 꼭 듣고 싶었던 말 Stay ,19871,633
2NE1,그리워해요,2013-11-21,그렇게 너무 편하게 굴지 마요 아직 너와 난 남남이니까 어린애처럼 보채지 좀 마요 아직 시작도 안 했으니까 아이들의 불장난 같은 사랑은 싫어 조금 움츠려 있을 뿐이야 난 괜찮아 아냐 사실 난 나를 떠나 보낸 그가 아직 너무 미워요 차갑게 식어버린 내 가슴은 아직도 그를 그리워해요 그리워해요 그리워해요 그리워해요 그리워해요 그렇게 너무 밝히지 좀 마요 세상은 원래 어두우니까 어쩜 그렇게 해맑게 웃어요 what 자세히 보니 슬픈 표정이야 I know I’ve been there before 어른들의 계산적인 사랑은 싫어 살짝 지쳐있을 뿐이야 난 괜찮아 아냐 사실 난 나를 떠나 보낸 그가 아직 너무 미워요 차갑게 식어버린 내 가슴은 아직도 그를 그리워해요 그리워해요 그리워해요 그리워해요 그리워해요 나의 젊은 날의 사랑은 이렇게 끝이 나네요 그대 꼭 행복해야 해요 오랜 시간이 지나가도 우리 서로 기억해요 그땐 서로가 있었음을 그땐 서로가 있었음을 ,85107,634
포지션,하루,2007-02-05,아직 그대는 오지 않고 또 하루가 지네요 마중나간 나의 마음은 또 혼자 돌아와요 눈물에 번진 구름같은 노을빛이 내리면 술 생각처럼 떠 오르는 그대 얼굴 그대 향기 그댄 왜 나를 사랑했나요 이렇게 나를 울게 하나요 사랑이 슬픔인 걸 그때 알았더라면 그대를 그냥 지나쳤을까 안보려고 눈 감아봐도 추억이 또 보여요 잃어버릴까 걱정하듯 처음부터 그 끝까지 귓볼을 입술로 간지르며 소리내 웃다 그대가 울죠 그 눈빛이 서러워 매번 놀라 잠깨면 베게를 적신 내 눈물만 그렇게 아름다운 사람을 사랑 안하곤 버틸힘 없죠 천번 그날이 와도 나는 같았을 테니 만난걸 미안해하지 말아요 하루 또 하루 버텨내도 그댄 오지 않네요 울고 싶을때 울어보면 그댄 내가 미울까요 그댄 왜 나를 사랑했나요 이렇게 나를 울게 하나요 사랑이 슬픔인 걸 그때 알았더라면 그대를 지나쳐갔을까 그렇게 아름다운 사람을 사랑 안하곤 버틸 힘 없죠 천번 그날이 와도 나는 같았을 테니 만난 걸 미안해하지 말아요 그리워 지친 날 달래듯 아침은 또 오네요 울 수 없으니 웃어야죠 밤새 잊은 것 처럼  ,40127,635
심규선 (Lucia),부디,2010-11-30,부디 그대 나를 잡아줘 흔들리는 나를 일으켜 제발 이 거친 파도가 날 집어 삼키지 않게 부디 그대 나를 안아줘 흔들리는 나를 붙잡아 제발 이 거친 바람이 나를 넘어뜨리려 해 저기 우리 함께 눈물짓던 그 때 그 모습이 보여 이젠 눈이 부시던 날의 기억 그래 그 순간 하나로 살테니 부디 다시 한 번 나를 안고 제발 지친 나를 일으켜줘 우리 사랑 했었던 날들 아직 모든 것들이 꿈만 같아 부디 다시 한 번 나를 깨워 제발 지친 나를 일으켜줘 다시 나의 손을 잡아줘 이제 잡은 두 손을 다신 놓지마 제발 그대 이렇게 다시 떠나가는 날 이젠 언제쯤 다시 볼 수 있을지 우리 이렇게 헤어지면 언젠가는 또 다시 부디 다시 한 번 나를 안고 제발 지친 나를 일으켜줘 우리 사랑 했었던 날들 아직 모든 것들이 꿈만 같아 부디 다시 한 번 나를 깨워줘 제발 지친 나를 일으켜줘 다시 나의 손을 잡아줘 부디 다시 한 번 나를 안아줘 부디 다시 한 번 나를 안아줘  ,81173,636
