가수명,노래제목,발매일,가사,좋아요수,순위
다비치,슬픈 다짐,2008-01-28,누가 다가와 말을 걸어도 이제 모른 척 하겠어 자꾸 다가와 날 유혹해도 더 차가워 지겠어 가슴 터지게 벅찬 고백에도 감동 하지는 않겠어 이제 날 쉽게 가질 수 없도록 철저히 감출꺼야 이런 다짐을 하고 또 해봐도 별 소용은 없을거야 네가 부르면 아마 그래 아마 다시 가 안기겠지 I Don't Wanna Do it again Don't Wanna Do it again 다시는 이렇게 사랑안할꺼야 지우다 지우다 너를 지워보다 널 끝내 못잊으면 I Don't Wanna Do it again Don't Wanna Do it again 다시는 이따위 사랑하지 않겠어 버티다 버티다 못버티면 나 끝내는 너를 또 찾아 가겠지 혹시 사랑을 다시 하게되면 그냥 사랑만 받겠어 버려진대도 아파지지 않게 내 맘은 안줄거야 이런 다짐을 하고 또 해봐도 별 소용은 없을거야 네가 온다면 아마 그래 아마 다시 또 사랑이지 I Don't Wanna Do it again Don't Wanna Do it again 다시는 이렇게 사랑안할꺼야 지우다 지우다 너를 지워보다 널 끝내 못잊으면 I Don't Wanna Do it again Don't Wanna Do it again 다시는 이따위 사랑하지 않겠어 버티다 버티다 못버티면 나 끝내는 너를 또 찾아 가겠지 우리가 너무 미워서 밤새워 너를 지워도 내 슬픈 사랑 지겨운 사랑 너를 또 기다리네 I Don't Wanna Do it again Don't Wanna Do it again 다시는 이렇게 사랑 안할꺼야 다시는 다시는 입술 깨물지마 왜 또 날 찾는거야 I Don't Wanna Do it again Don't Wanna Do it again 다시는 이따위 사랑하지 않겠어 다시는 다시는 그러지마 왜 너 없는 나를 꿈 꿀 수도 꿈 꿀 수도 없어 ,21730,737
디셈버,배운게 사랑이라,2010-03-04,내 마음다 가져간 사람 내일은 더 그리운 사람 가슴만 애태우고 눈물만 준대도 고마운 사람 내 심장이 원하는 사람 내 입술이 부르는 사람 보고싶은데 이렇게 원하는데 그댄 어디있나요 내 가슴에 비라도 내렸으면 좋겠어 비에 널 흘려보내게 도저히 지워지지가 않아 내 머리속엔 아직도 네 모습밖에 떠오르지가 않아 배운게 사랑뿐이라서 가진게 너하나 뿐이라서 니가 아니면 다른 사랑은 못해 너도 알잖아 안녕이란 말도 못했는데 이렇게 가면 난 어떡해 힘든 내 삶의 쉼표 같은 사람 너 한사람뿐야 한동안 난 많이 힘들겠지 네 이름만 또 부르겠지 사랑하는데 정말 사랑했는데 떠난 그대 미워요 너 때문에 망가진 날 봤으면 좋겠어 미안해서 돌아오게 죽어도 널 잃고 싶진 않어 그리움보다 더 진한 너의 향기가 잊혀지지가 않아 배운게 사랑 뿐이라서 가진게 너하나 뿐이라서 니가 아니면 다른 사랑은 못해 너도 알잖아 안녕이란 말도 못했는데 이렇게 가면 난 어떡해 힘든 내 삶의 쉼표 같은 사람 너 한사람 뿐야 사랑을 받는 것보다 주는게 더 좋았던 사람 그보다 더한 사랑이란 없을 것 같아 배운게 사랑 뿐이라서 가진게 너 하나 뿐이라서 니가 아니면 다른 사랑은 못해 너를 사랑해  ,15435,738
존박,Falling,2012-02-22,하얗게 번지는 머릿속에다 그대를 새겨놓고 저 멀리 날아가 모든 게 보이는 두 눈을 감고서 시간을 되돌려서 그 때로 돌아가고 싶어 Falling 이대로 falling for you 날 잡아줄 수 없어도 Falling 또 다시 falling for you 날 감싸줄 수 없나요 좋았던 나날도 너무 아팠던 날도 이제 돌이켜보면 그저 그랬었나요 아니라 말해요 멍든 가슴도 멍해진 내 마음도 다시 느낄 수만 있다면 Falling 이대로 falling for you 날 잡아줄 수 없어도 Falling 또 다시 falling for you 날 감싸줄 수 없나요 까맣게 번지는 하늘 위에서 한없이 추락하는 날 보고만 있네요 Falling 이대로 falling for you 이런 날 잡아 주세요 Falling 또 다시 falling for you 제발 날 감싸 주세요 한없이 추락하더라도 바닥까지 떨어져도 그댈 향해 난 falling for you 그저 그대만 보네요 ,69286,739
디셈버,별이 될께,2014-03-07,내 사랑은 변하지 않을 께 저 하늘은 내 맘 알고 있겠죠 난 언제나 하늘 높은 곳에서  그대를 비춰주는 별이될께 널 사랑한다는 말은 참 아껴왔는데 그댄 하늘 저 멀리 날 두고 가네요  늘 언제나 니 곁을 지켜주지 못해 내가 정말 미안해요 I'M Still With You 우리 함께  걷던 이길 도 어느새 이렇게도  많이 변했는데 오 오 난 아직도 잊지 못하네요  비록 사랑이 눈물일 지라도 내 사랑은 변하지 않을 께 저 하늘은 내 맘 알고 있겠죠 난 언제나 하늘 높은 곳에서 그대를 비춰주는 별이 될께 그대는 목소리도 참 고왔었는데 이세상 어디에도 그대는 없네요 늘 어린 아이처럼 매일 투정 부린 내가 정말 후회가 돼요 I'M Still With You 우리함께 나눈 추억도가슴에 내 머리속엔 다 그대론데 오 오 난 아직도 잊지 못하네요 비록 사랑이 눈물일 지라도 내 사랑은 변하지 않을께저 하늘은 내 맘 알고있겠죠 난 언제나 하늘 높은곳에서 그대를 비춰주는 별이될께 내 사랑을 꼭 기억해 줘요 내 눈물을 그댄 듣고있나요 기억할께 십년이 지나도 나 약속해 그대를 잊지 않을께 그댈 비추는 별이될께 ,16618,740
iKON,이별길 (GOODBYE ROAD),2018-10-01,goodbye goodbye 이별을 알았다면 그토록 사랑하지 말 걸 그랬나 봐요 (check it out yo) 무덤덤해져 가는 서로의 감정 때문에 상처를 주는 것조차도 이제 무덤덤한 우리 이미 사랑은 떠났고 정밖에 남지 않았어 그냥 그런가 하고 뜨뜻미지근 해졌지 (where you at) 관심은 집착이 되어 버리고 (where you at) 의심은 거의 밥 먹듯이 해 너와 내가 쌓았던 신뢰란 성은 무너지고 넌 이제 이별길을 걸으며 새사람을 찾지  같이 울기 위해 널 만난 건 아닌데 (눈물이 난다) 상처받기 위해 쌓은 추억이 아닌데 (잊혀져 간다) 너무 쉽게 또 한 사람과 남이 돼 고작 이별하기 위해 널 사랑한 건 아닌데 (익숙해져 간다)  잘 가요 그 험한 이별길을 나를 떠나 부디 꽃길만 걸어요 조심히 가요 외로운 이별길을 가는 길에 나의 모든 기억을 버려요 (check it out) 지나간 기억 속에서 산다는 건 그 얼마나 무기력한 외로움일까 그 기억 속에서조차 잊혀진다는 건 또 어떤 순간보다 잔인한 아픔인가 죽도록 사랑했건만 끝내 나 죽지 않았네 숨을 깊게 들이마셔도 내뱉으면 한숨이 돼 누구나 하는 이별이니 우리 슬퍼 말아요 난 또 그대 닮은 듯 아닌 사람 찾아갈게요 같이 울기 위해 널 만난 건 아닌데 (눈물이 난다) 상처받기 위해 쌓은 추억이 아닌데 (잊혀져 간다) 너무 쉽게 또 한 사람과 남이 돼 고작 이별하기 위해 널 사랑한 건 아닌데 (익숙해져 간다) 잘 가요 그 험한 이별길을 나를 떠나 부디 꽃길만 걸어요 조심히 가요 외로운 이별길을 가는 길에 나의 모든 기억을 버려요 (check it out)  goodbye goodbye 이별을 알았다면 그토록 사랑하지 말 걸 그랬나 봐요  goodbye goodbye 어차피 떠난다면 어떤 미련도 남지 않게 보란 듯이 살아요 (check it out)  잘 가요 어여쁜 내 사람아 나를 떠나 행복하게만 살아요 (행복하게만 살아요) 조심히 가요 가슴 아픈 사랑아 내 곁에 있을 때처럼 아프지 말아요 (그대 아프지 말아요) 나 나나나나나나 나나나나나나 나나나나나 나나나나 나 나나나나나나 나나나나나나 나나나나나 (check it out) ,101435,741
이적,다행이다,2007-04-19,그대를 만나고 그대의 머릿결을 만질 수가 있어서 그대를 만나고 그대와 마주보며 숨을 쉴 수 있어서 그대를 안고서 힘이 들면 눈물 흘릴 수가 있어서 다행이다 그대라는 아름다운 세상이 여기 있어줘서 거친 바람속에도 젖은 지붕 밑에도 홀로 내팽개쳐져 있지 않다는게 지친 하루살이와 고된 살아남기가 행여 무의미한 일이 아니라는게 언제나 나의 곁을 지켜주던 그대라는 놀라운 사람 때문이라는 거 그대를 만나고 그대와 나눠먹을 밥을 지을 수 있어서 그대를 만나고 그대의 저린 손을 잡아 줄 수 있어서 그대를 안고서 되지 않는 위로라도 할 수 있어서 다행이다 그대라는 아름다운 세상이 여기 있어줘서 거친 바람속에도 젖은 지붕 밑에도 홀로 내팽개쳐져 있지 않다는게 지친 하루살이와 고된 살아남기가 행여 무의미한 일이 아니라는게 언제나 나의 곁을 지켜주던 그대라는 놀라운 사람 때문이라는 거 그대를 만나고 그대의 머릿결을 만질 수가 있어서 ,53642,742
더 넛츠 (The NuTs),내 사람입니다,2006-12-18,뵙고 싶었죠 당신이군요  그녀의 마음 흔든 그 사람 못났다 웃어도 좋아요 염치없지만 당신께 이렇게 무릎 꿇어요 내 사랑입니다 목숨 같은 내 여자입니다 부탁해요 부탁해요 그녈 흔들지 마요 내 전부입니다 그녀 없인 난 무너집니다 도와줘요 떠나줘요 그녀가 없어도 당신은 살잖아요 나는 안돼요 가진 게 없죠 그래요 나는 보잘 것 없죠 당신에 비해 하지만 내 안에 눈물은 팔아서라도 그녀를 행복케 해줄 거예요 내 전부입니다 그녀 없이 나 무너집니다 도와줘요 떠나줘요 그녀가 없어도 당신은 살잖아요 나는 안돼요 내 눈을 원하면 그대가 가져요 심장을 원하면 얼마든 가져요 내 숨을 원하면 그것도 가져요 그녀만은 하나만은 나에게서 제발 데려가지 말아요 날 울리지 마요 난 사랑합니다 그녀만을 참 사랑합니다 단 한 사람 단 한 사람 그녀가 있기에 숨 쉬며 살아가는 남자입니다 ,27618,743
이하이,그 한마디 (바른연애 길잡이 X 이하이),2021-03-14,괜찮아진다는 건 흐르는 시간 속에 슬픔을 다 맡기고 버티는 거더라 기나긴 시간 곁에서 나보다 날 아끼며 헤매던 마음에 손 내밀어 준 너 두 눈을 보며 건네준 그 한마디가 늘 아낌없이 나를 안아주던 너의 그 한마디가 굳게 닫혀있던 내 마음에 살며시 스며든 거야 긴 밤의 끝을 지나 내 모든 방황은 결국 널 향한 하나의 이유였나 봐 사랑받는다는 건 내 깊은 아픔을 나보다 더 아파해주는 거더라 무너져 내릴 것 같은 밤이 찾아오면 늘 사랑이란 이름으로 날 감싸준 너 두 눈을 보며 건네준 그 한마디가 늘 아낌없이 나를 안아주던 너의 그 한마디가 굳게 닫혀있던 내 마음에 살며시 스며든 거야 긴 밤의 끝을 지나 내 모든 방황은 결국 널 향한 하나의 이유였나 봐 언제부턴지 알 수는 없지만 아무 말 없이 내어준 품에 내 맘이 기대어 쉰 거야 수백 번 말해도 모자란 그 한마디를 온통 밤이었던 내 맘에 불빛을 켜주던 그 한마디를 이젠 내가 해주려 해 네가 그랬듯이 오래도록 너와 난 우리라는 이름으로 남겠다고 약속할게 ,38077,744
임창정,이미 나에게로,1995-04-30,이 꿈이 멎어버린 순간에 난 깨닫고 널 생각해 어쩜 난 너에 힘겨움을 함께 짊어지고 갈 수 있어 할 말이 많기도 하고 목소리도 그리워 전화를 했어 씁쓸한 목소리가 들리고 난 미안함에 당황도 했어 난 너무 힘들어서 그런 이유로 만나기 미안해 둘이 할 때는 너만을 생각하려 했는데 문득 어떤 고민에 널 앞에 두고 뭐가 그리 힘들어 내 미래에 완성속에 있는 너인데 이미 나에게로하여 집착하게 만든 넌 방황에 지쳐 쓰러져 버린 내가 다시 일어서는 모습 생각하며 날 찾을수 있니 이미 나에게로하여 집착하게 만든 넌 실패에 주저앉은 처참한 날 본 후 다시 용기 얻는 모습 생각하며 날 사랑해 줄수 있겠니 낙엽이 진 나무위로 하얀 서리가 내린 새벽 내가 이세상을 보았을 때 얌전하고 고요하게 내곁에 있어준 너를 생각하며 난 너무 힘들어서 그런 이유로 만나기 미안해 둘이 할 때는 너만을 생각하려 했는데 문득 어떤 고민에 널 앞에 두고 뭐가 그리 힘들어 내 미래에 완성속에 있는 너인데 이미 나에게로하여 집착하게 만든 넌 방황에 지쳐 쓰러져 버린 내가 다시 일어서는 모습 생각하며 날 찾을수 있니 이미 나에게로하여 집착하게 만든 넌 실패에 주저앉은 처참한 날 본 후 다시 용기 얻는 모습 생각하며 날 사랑해 줄수 있겠니 이미 나에게로하여 집착하게 만든 넌 방황에 지쳐 쓰러져 버린 내가 다시 일어서는 모습 생각하며 날 찾을수 있니 이미 나에게로하여 집착하게 만든 넌 실패에 주저앉은 처참한 날 본 후 다시 용기 얻는 모습 생각하며 날 사랑해 줄수 있겠니 ,16374,745
MSG워너비,난 너를 사랑해,2021-07-10,문득 떠오른 기억에 잠 못 드는 나의 마음을 넌 모르니 지나버린 그 추억은 왜 그런지 가슴에 여전히 사나봐 살다가 내 생각이 날 때면 그땐 언제든 찾아와줘 내 사랑 너이니까 난 여기에 서 있을게 난 너를 사랑해 내린 빗방울 수보다 사랑해 계절이 몇 번을 변한대도 난 항상 이 자리에 서 있을게 난 네가 필요해 내가 숨 쉴 수 있는 유일한 사람 내가 사랑할 사람은 너 뿐이야 아직 못 다한 말들이 있다는 걸 너는 혹시 느낄 수 있니 두 눈 가득 고인 눈물이 흘러도 한 번쯤 모른 척 해 줄래 가슴에 좋았던 추억들이 나를 살아가게 하나봐 눈감아 그려보면 네가 올 것만 같은데 난 너를 사랑해 내린 빗방울 수보다 사랑해 계절이 몇 번을 변한대도 난 항상 이 자리에 서 있을게 난 네가 필요해 내가 숨 쉴 수 있는 유일한 사람 내가 사랑할 사람은 너 뿐이야 두 눈이 참 예뻤던 널 날 보면 늘 안아주던 널 세상 어디라 해도 찾아갈게 조금만 기다려줘 난 너를 사랑해 난 너를 사랑해 내린 빗방울 수보다 사랑해 My everything 계절이 몇 번을 변한대도 난 항상 이 자리에 서 있을게 하루 또 하루가 내게는 영원이란 시간인가 봐 그래도 난 너를 기다려 사랑해 가슴 깊이 네게 하는 말 사랑해 ,21633,746
반하나,벌써일년,2021-05-30,처음이라 그래 며칠 뒤엔 괜찮아져 그 생각만으로 벌써 일 년이 너와 만든 기념일마다 슬픔은 나를 찾아와 처음 사랑고백하며 설렌 수줍음과 우리 처음 만난 날 지나가고 너의 생일에 눈물의 케익 촛불 켜고서 축하해 I believe in you I believe in your mind 벌써 일 년이 지났지만 일 년 뒤에도 그 일 년 뒤에도 널 기다려 아직도 이별하는 중이야 별짓 다해가며 참고 또 참고 있잖아 허전함 채워 보려 누군가를 만나봐도 결국에는 제자리 baby i keep thinkin bout you 우린 멀어졌지만 나눠낀 이어폰에 들려오던 멜로디가 자꾸만 내 귓가에 I believe in you I believe in your mind 다시 시작한 널 알면서 이젠 나 없이 추억을 만드는 너라는 걸 내가 기억하는 추억은 언제나 지난 웃음과 얘기와 바램들 또 새로 만들 추억은 하나뿐 내 기다림과 눈물 속 너일뿐 한켠의 빈자릴 독한 술로 가득 채웠어 흔한 안부조차 물을 수 없는 사이가 된 거야 그날 밤에 모질게 던진 말들 진심이 아닌데 매번 이렇게 널 아프게만 해 우리 사랑했던 날 그날로 돌아갈 수만 있다면 남은 시간 전부라도 버릴 수 있어 I believe in you I believe in your mind 다시 시작한 널 알면서 이젠 나 없이 추억을 만드는 너라는 걸 I believe in you I believe in your mind 벌써 일 년이 지났지만 일 년 뒤에도 그 일 년 뒤에도 널 기다려 다섯 번의 엇갈렸던 전화 무심한 듯 애쓰지만 애틋해 너무 멀리 와버렸나 봐 우린 ,13940,747
윤건,우리 둘만 아는,2017-10-31,우리 둘만 아는 아지트 그때 너만 아는 내 옷차림 우리 둘만 아는 언어 그때 나만 아는 니 표정 우리 둘만 아는 여행 그때 너만 아는 내 기분 우리 둘만 아는 맛집 그때 나만 아는 니 메뉴 니가 없는 하루를 견뎌내기 힘들어 혼자 먹는 커피는 왜 이렇게 쓴 거니 너라면 1분1초 내가 없어도 살아갈 수 있겠니 우리가 어떻게 지내왔는데 이렇게 끝나버리겠니 너 없인 단 하루도 도저히 힘들 것 같아 머물러줘 내 곁에만 내가 언제든 만질 수 있게 우리 둘만 아는 아지트 그때 너만 아는 내 잠버릇 우리 둘만 아는 장난 그때 나만 아는 니 농담 우리 둘만 아는 노래 그때 너만 아는 내 목소리 우리 둘만 아는 비밀 그때 나만 아는 니 고민 니가 없는 하루를 견뎌내기 힘들어 혼자 부르는 노래는 왜 이렇게 슬프니 너라면 1분1초 내가 없어도 살아갈 수 있겠니 우리가 어떻게 지내왔는데 이렇게 끝나버리겠니 너 없인 단 하루도 도저히 힘들 것 같아 머물러줘 내 곁에만 내가 언제든 만질 수 있게 우리가 함께 나눴던 날들 너와나 함께 나눴던 날들 날 제일 잘 아는 건 너란 말야 우리가 어떻게 지내왔는데 이렇게 끝나버리겠니 너 없인 단 하루도 도저히 힘들 것 같아 머물러줘 내 곁에만 내가 언제든 만질 수 있게 ,95127,748
이수영,휠릴리,2004-09-09,누구도 원할 줄 몰랐죠 이 날이 오기 전에 난 어떻게 품는 줄 몰랐죠 그댈 만나기 전에 휠릴리 여길 좀 보아요 휠릴리 내게로 걸어와요 휠릴리 왜 잘못 가나요 잘 봐요 그녀가 아니라 나예요 얼마나 불어야 아나요 얼마나 커야 그대가 듣나요 고단한 사랑은 한번도 쉰 적이 없는데 언제 날 알아 보나요 언제나 날 사랑하게 되나요 그대가 나라면 참 쉬운 일일텐데 이제는 멈출 줄 모르죠 시작만 있나 봐요 난 그대밖에는 더 모르죠 배우고 싶지 않아 휠릴리 그녀와 행복이 휠릴리 날 불행하게 해요 휠릴리 난 될 수 없나요 잘 봐요 내 안에 그대도 그대죠 얼마나 불어야 아나요 얼마나 커야 그대가 듣나요 고단한 사랑은 한번도 쉰 적이 없는데 언제 날 알아 보나요 언제나 날 사랑하게 되나요 그대가 나라면 참 쉬운 일일텐데 마음에 돌을 더 얹어도 그리움 무게만 못하죠 두 눈이 멀게 될 순간까지 난 보고싶어 기다려도 올 수 없나요 그대의 내일에도 난 없나요 그대가 오기 전 가슴을 접을 수 없는데 정녕 잊을 날 오나요 잊으려 애쓰면 잊게 되나요 늘 먼저 잊는건 잊잔 그 맘 부턴데 날 잊어야 그댈 잊을까요 ,33546,749
정승환,언제라도 어디에서라도,2020-06-17,살랑 춤추는 커튼 방안 가득한 햇살 난 멍하니 앉아 전화만 보네 엄지 손가락 아래 참 좋았던 시간들 함께라 더 푸르던 그 여름 모든 게 꿈같아 널 위해 만든 이 멜로디 끝나지 않을 이야기 노래를 따라 도착한 곳엔 어제처럼 네가 있기를 너와 거리를 걷고 너와 저녁을 먹고 아무렇지 않게 약속한 날들 바다를 보고 싶어 바람이 되고 싶어 제자리로 결국 돌아오는 모든 여행처럼 널 위해 만든 이 멜로디 끝나지 않을 이 노래 만들지 못한 마지막 멜로디 그래 그건 오직 너였어 숨이 차게 달려 벅차 오른 목소리로 부를게 노래할게 언젠가 만날 긴 터널 끝에서 너를 기다릴게 좋은 바람 다시 불어오면 웃으며 이 노랠 부르자 너와 나 우리는 내일을 기대하는 이유 그 모습 그대로 기억할게 언제라도 너와 나 우리는 내일을 기대하는 이유 그 모습 그대로 기다릴게 어디에서라도 ,51258,750
다비치,너 없는 시간들,2018-01-25,마음이 툭 하고 끊어진 것 같아 한동안 멍하다 금세 너무 아파 우우우우 잘 지내 차가운 너의 그 한마디 머뭇대며 왜냐고 물어보려다 그만두기로 해 이제 와 뭐가 중요하겠니 이별의 이유 따위 달라지는 건 없을 텐데 가까스로 한동안 버티겠지 엉망으로 너 없는 시간들을 그러다 네 소식에 잘 지낸단 말에 무너지듯 못 견디게 보고 싶겠지 나는 그런가 봐 내 마음 한편에선 참 못난 생각만 해 적어도 나보단 더 아프길 나보다 늦게 잊길 나 때문에 잠 못 이루길 너 없이 가까스로 한동안 버티겠지 엉망으로 너 없는 시간들을 그러다 네 소식에 잘 지낸단 말에 무너지듯 못 견디게 그립고 못 견디게 밉겠지 어쩌면 나에게 미안해서 널 너무 사랑한 내가 안쓰러워서 잘 지내고 싶은데 네 말처럼 일분 일초가 엉망이야 이별이 다 그렇지 괜찮은 척 지내다 한순간 주저앉고 말아 우연히 보게 된 누군가와 웃는 네 사진에 못 견디게 그립고 또 못 견디게 밉겠지 어쩌면 나에게 미안해서 널 너무 사랑한 내가 안쓰러워서 잘 지내고 싶은데 네 말처럼 일분 일초가 엉망이야 너 없인 ,66942,751
이적,거짓말 거짓말 거짓말,2013-11-15,다시 돌아올 거라고 했잖아 잠깐이면 될 거라고 했잖아 여기 서 있으라 말했었잖아 거짓말 거짓말 거짓말 물끄러미 선 채 해가 저물고 웅크리고 앉아 밤이 깊어도 결국 너는 나타나지 않잖아 거짓말 음 거짓말 우우 그대만을 하염없이 기다렸는데 우우 그대 말을 철석같이 믿었었는데 우우우우우 찬 바람에 길은 얼어붙고 우우우우우 나도 새하얗게 얼어버렸네 내겐 잘못이 없다고 했잖아 나는 좋은 사람이라 했잖아 상처까지 안아준다 했잖아 거짓말 거짓말 음 다시 나는 홀로 남겨진 거고 모든 추억들은 버리는 거고 역시 나는 자격이 없는 거지 거짓말 음 우우 그대만을 하염없이 기다렸는데 우우 그대 말을 철석같이 믿었었는데 우우우우우 찬 바람에 길은 얼어붙고 우우우우우 나도 새하얗게 얼어버렸네 철석같이 믿었었는데 거짓말 거짓말 거짓말 ,112072,752
고유진 (플라워),걸음이 느린 아이,2004-04-09,함께 걸으면 손닿지 못할만큼 한참을 뒤에 오던 그녀였죠 빨리 오라며 그녀를 다그치고 답답한 마음에 난 앞서서 걸었는데 천천히 걸을걸 그랬죠 먼저간 날 잃었었는지 그녀가 오질 않네요 하루를 헤매다 돌아온 그녀는 어제보다 많이 다른 모습이죠 날 보며 웃는 미소도 그 향기도 모두 예전과 같은데 낯설은 그대 모습 사소한 일로 많이 다툰 날이었죠  평소와 다른 그녀 모습보고 먼저 다가가 그녈 달래봤지만 내말도 들으려 않은채 울고있죠 사랑하는 사람있다고 허락해 줄수만 있다면 그 사랑 안고 싶다고 고개를 저으면 그저 난 저으면 예전처럼 다시 만날수 있나요 조금 더 함께 하고파 그렇게도 천천히 걷던 그녀를 알지못한 내 죄로 보내야 하나요 그대 혼자서 나를 남겨둔채 가는건 여린 그대가 참 힘든일이라 나 그대 따라서 이별이란 슬픈 세상에 나도 함께 갈께요 고개를 저으면 그저 난 저으면 예전처럼 다시 만날 수 있나요 조금 더 함께 하고파 그렇게도 천천히 걷던 그녀를 난 보내야만 하죠 ,27340,753
양다일,널 그리워하고 있어,2021-11-10,우리 헤어진 게 언제인지 기억나지 않던 어느 날 잠이 오지 않아 아무 생각 없이 기억 속에서 널 꺼내 본다 넌 이미 떠났고 난 계속 그리워해 보이지 않아 붙잡으려 손을 뻗고 있어 뭘 어떡하려고 널 또 찾는지 지나간 사랑에 아쉬움들이 남았을까 우리 만났던 그 시간들이 아름다웠던 건 몰랐어 이제 알아보니 다 내 잘못인걸 되돌아가고 싶은 마음뿐인데 넌 이미 떠났고 난 계속 그리워해 보이지 않아 붙잡으려 손을 뻗고 있어 뭘 어떡하려고 널 또 찾는지 지나간 사랑에 아쉬움들이 남았을까 짧게나마 잊고 살 수 있다면 좋을 텐데 그러지 못해 어떡하니 나 넌 이미 떠났고 네 품이 그리워도 보이지 않아 미안하단 말도 못 하는데 뭘 어떡하려고 널 또 찾는지 지나간 사랑은 아쉬움들로 가득한걸 ,11278,754
