가수명,노래제목,발매일,가사,좋아요수,순위
임창정,오랜만이야,2009-03-10,참 오랜만이란 말로 웃으며 인사 하는 너 처음 널 만날 때처럼 내 가슴이 철없이 또 뛰어 꼭 행복 하라는 말로 울면서 보내줬는데 그 말이 무색 할 만큼 너 왜 이렇게 많이 야위었어 무슨 일 있었던 거니 세상을 다 줄 것 같은 그 사람과 오래오래 잘 사는게 행복 하는게 그렇게 힘이 들었니 붙잡을걸 그랬나봐 내가 더 사랑한다 말할걸 가진게 너무 없어 줄게 너무 없어 안되는 줄 알았어 기다릴걸 그랬나봐 네가 돌아올 줄 알았다면 혼자가 아닌 나라 널 잡을 수 없어 바보 같지만 미안해 나 다시 널 보낼게 좀 일찍오지 그랬어 너땜에 힘들었는데 죽을 것 같았던 나를 그녀가 겨우 구해줬는데 나 왜 이렇게 못됐니 네 작은 어깨를 꼭 안고 싶어져 자꾸만 후회 되는게 미치겠는게 아프게 너를 또 원해 붙잡을걸 그랬나봐 내가 더 사랑한다 말할걸 가진게 너무 없어 줄게 너무 없어 안되는 줄 알았어 기다릴껄 그랬나봐 네가 돌아올 줄 알았다면 혼자가 아닌 나라 널 잡을 수 없어 바보 같지만 미안해 나 다시 널 보낼게 몰라볼걸 그랬나봐 널 닮은 사람이지 그랬어 내 앞에 있는 너를 애써웃는 너를 안아줄 수도 없는데 스쳐갈걸 그랬나봐 고갤 돌리지 말걸 그랬어 멀어져가는 너를 난 잡을수 없어 다시 한번 더 부탁해 나 보다 더 행복해  ,66892,501
f(x),Goodbye Summer (f(Amber+Luna+Krystal) (Feat. D.O. Of EXO-K),2013-07-29,기억해 복도에서 떠들다 같이  혼나던 우리 둘 벌서면서도 왜 그리도 즐거웠는지  알았어 그날 이후로 Yeah Yeah 우린 늘 Yeah Yeah 쌍둥이 별자리처럼 넌 나 나는 너였어 졸업하기 전날 많이 울던 너  남자라고 꾹 참던 너 하고 싶었던 말 못하고 뜨거웠던 그 여름처럼 안녕 친구라는 이름 어느새 미워진 이름 감추던 감정은 지금도 아픈 비밀의 기억일 뿐 우리 사인 정리할 수 없는 사진  보면 가슴 아린 Story I'm sorry  여름아 이젠 Goodbye Yay Yeah What do I say We didn't  have to play no games I should've took that chance I  should've asked for u to stay And it gets me down the unsaid  words that still remain 시작하지도 않고 끝나버린 이야기 축제 마지막 날 너의 노래도  아른한 여름 바다도 함께라서 소중했던 맘 늦어가는 밤  하늘처럼 안녕 친구라는 이름 어느새 미워진 이름 감추던 감정은 지금도 아픈 비밀의 기억일 뿐 우리 사인 정리할 수 없는 사진 보면 가슴 아린 Story I'm sorry 여름아 이젠 Goodbye Baby Oh No Oh Oh 혼잣말이라서 미안해 Oh 사실은 널 사랑해 Yeah 숨기고 있던 오랜 비밀들 차라리 들켰다면 너를 품에 안아줄텐데 친구라는 이름 어느새 미워진 이름 감추던 감정은 지금도 아픈 비밀의 기억일 뿐 우리 사인 정리할 수 없는 사진 보면 가슴 아린 Story I'm sorry 여름아 이젠 Goodbye 친구라는 이름 어느새 미워진 이름 보면 가슴 아린 Story I'm sorry 여름아 이젠 Goodbye Yay Yeah 랄랄랄랄라 랄랄랄랄라랄랄 랄랄랄랄라 랄랄랄랄랄라 ,118166,502
이승철,잊었니,2012-02-17,잊었니 날 잊어버렸니 그 수많은 추억들은 잊어 버렸니 가슴은 널 향해 팔 벌려 오늘도 간신히 버티고 있는데 추억이 점점 빛 바래 가면 너와 거닐던 길에 우두커니 서 지우고 또 지우려 해도 니숨결 목소리가 귓가에 들려 잊었니 날 잊어 버렸니 아직 난 널 기다리잖아 사랑이 또 울고 있잖아  가슴엔 늘 눈물이 고여 지워도 자꾸 지우려 해도 그대 얼굴이 자꾸 떠오르네요 잊었니 날 잊어버렸니 수많은 추억들은 잊어 버렸니 가슴은 널 향해 팔 벌려 오늘도 간신히 버티고 있는데 잊었니 날 잊어 버렸니 아직난 널 기다리잖아 사랑이 또 울고 있잖아  가슴엔 늘 눈물이 고여 잊었니 날 잊어 버렸니 아직난 널 기다리잖아 사랑이 또 울고 있잖아  가슴엔 늘 눈물이 고여 지워도 자꾸 지우려 해도 그대 얼굴이 자꾸 떠오르네요 지워도 자꾸 지우려 해도 그대 얼굴이 자꾸 떠오르네요 그대 얼굴이 자꾸 떠오르네요,32090,503
신용재 (2F),사계 (四季),2022-06-08,따스한 온기가 더 외롭게 한 봄 내리쬔 햇살에 더 고된 여름 긴 하루 지친 계절 지켜준 단 한 사람 멀어진 하늘 걱정 많던 그 가을 얼어버린 창가 맘 시린 겨울 비바람 거친 파도 안아준 그대란 사람 때로는 이 길이 더 서글퍼져도 하나만 기억해 이젠 내가 그대의 모든 계절을 안아줄게 함께라면 무엇도 상관없어 온 세상이 우릴 막아선대도 모든 사람이 등을 돌린대도 어떤 계절이건 다 두렵지 않아 한여름 사막을 걸어도 피할 곳 하나 없는 눈보라도 그대와 함께라면 소란한 세상 속 맘 닫힐 때면 하나만 기억해 이젠 내가 그대의 모든 계절을 안아줄게 함께라면 무엇도 상관없어 온 세상이 우릴 막아선대도 모든 사람이 등을 돌린대도 어떤 계절이건 다 두렵지 않아 한여름 사막을 걸어도 피할 곳 하나 없는 눈보라도 그대와 나 함께라면 너의 손 꼭 잡을게 내 사랑을 니가 느낄 수 있도록 그대의 모든 계절을 함께할게 그댄 그대로 충분해 내 사랑에 그대와 쉴 수 있게 봄 여름 가을 겨울 그대 곁에,3481,504
10CM,Perfect,2018-09-23,어제는 아름답고 오늘은 지옥 같아 바늘처럼 따가운 빗물이 멈추지 않네 눈앞이 캄캄해져 볼 수 없고 숨도 못 쉰다더니 정말 그렇네 내가 널 괴롭혔지 나 땜에 짜증 났지 내 주제를 알았을 때쯤 영화는 끝났네 결말을 맞은 악역 배우처럼 나는 지워져 가고 너는 더욱더 빛났지 쓰잘데 없는 나를 제때 버리질 않았으니까 멀쩡한 너의 모든 게 엉망이 됐지 내가 없는 너는 이제야 모든 게 다 완벽해 내가 눈치가 빨랐다면 좀 나았을 텐데 넌 내가 불안하지 나 땜에 곤란했지 난 손에 닿은 모든 것들을 망가 뜨렸지 비참한 끝을 앞둔 괴물처럼 나를 물리쳐야만 지루한 이야기가 끝나지 쓰잘데 없는 나를 제때 버리질 않았으니까 멀쩡한 너의 모든 게 엉망이 됐지 내가 없는 너는 이제야 모든 게 다 완벽해 내가 눈치가 빨랐다면 좋았는데 너를 생각하는 이 밤이 더럽게 구차해서 유치한 말을 밤새워 중얼거렸지 내가 없는 너는 아무리 생각해도 완벽해 내가 눈치가 빨랐다면 좀 나았을 텐데 이제 너는 문제없는 평화로운 밤을 어제는 아름답고 오늘은 지옥 같아 ,77361,505
전건호,다정히 내 이름을 부르면 (남자 Ver.),2021-10-18,뜨거운 계절을 보내던 날 기분 좋은 바람이 두 빰을 스치는 가을 바다 한곳에 서서 아름다운 너와 나 그림을 그려갔어 모래 위 떨린 손끝으로 날 향해 웃어주는 입술 끝 모양과 태양보다 예쁘게 붉은 두 볼을 가진 네가 다정히 내 이름을 부르면 내 마음이 녹아내려 언제나 나 하날 위해 준비된 선물 같아 널 안으면 잠들지 않는 바다 위를 너와 함께 걷는 것 같아 하늘 아래 너와 나 남은 내 모든 날을 너에게 다 줘도 안 아까워 이제서야 내가 사랑에 눈을 뜬 건 가봐 경험하지 못했고 믿기지 않는 일만 일어나고 있는 거 아니 10월에 피는 코스모스 향기를 가득 담아 부는 바람에 살며시 실어 보내 다정히 내 이름을 부르면 내 마음이 녹아내려 언제나 나 하날 위해 준비된 선물 같아 널 안으면 잠들지 않는 바다 위를 너와 함께 걷는 것 같아 하늘 아래 너와 나 설레이는 지금이 꿈이 아닌 걸 알잖아 난 더 바랄 게 없어 먼 훗날 내 생애 아주 작은 소리로 귓가에 말할 거야 내 곁에 머물러줘서 마음 다해 고맙다고 어떤 말로도 표현 못 할 내 인생의 전부였다고 이 순간 너를 꼭 안고 고백할게 언제나 우리 모든 날들과 햇살 아래 우리 그림자 제일로 특별하다고 세 계절의 끝을 지나서 너의 앞에 서있는 지금 선명한 목소리로 널 사랑한다고 말할게 ,10432,506
정준일,첫 눈,2017-01-01,내 마음을 한번만 만져줘요 온종일 이렇게 서늘해요 겨울보다 차가운 하늘 그아래 내가 서 있으니 눈물도 얼어버릴듯 해 조용히 한번만 불러줘요 수없이 말하던 내 이름을 영원을 거슬러 하루를 아니 일분을 보게 돼도 그럴수 있다면 견뎌낼게 그 기다림 끝에 그대가 서있어주길 내겐 그림같았던 그대와 기억 아주 오래 기다렸던 선물같은 하루 긴 시간을 건너서 네게 닿을게 내 마음에 첫눈이던 그대 넌 언제나 내겐 아득하다 그대와의 시간 그 하루가 내겐 왜 이렇게 아픈가요 너의 옆에 내가 서 있고 서로 웃을수 있는 하루 그릴수 없어서 눈물나죠 이게 꿈이라면 내마음을 전해줄텐데 내겐 그림같았던 그대와 기억 아주오래 기다렸던 선물같은 하루 긴 시간을 건너서 네게 닿을게 내 마음에 첫 눈이던 그대 함께 울고 많이 웃던 우리 아름답고 찬란하게 빛나던 시간 되돌린다 내겐 하루 같았던 너와의 기억 가슴뛰게 아름다웠던 너와의 시간 그대 입술에 이젠 인사를 하죠 그대 눈에 그대의 숨결에 부서지게 그대를 안는다 조용히 한번만 들어봐요 나직이 울리는 내 마음을 ,105458,507
권진아,이별 뒷면,2018-02-02,좁은 골목길은 또 하염없이 멀어져 마주앉은 탁자 반대편마저도 뻗어봐도 맞닿을 수가 없어서 내 맘 언제부턴가 긴 그늘을 드리워 우리는 서로가 괜찮다 하는데 완전히 돌아갈 수는 없는 걸 감았다 떠보니 너무 멀리 와있어 이제 이별 뒷면에 서있는 우리 내게 넌 벅차도록 행복했던 꿈 이제 마지막 장을 넘겨야겠어 많이 아플 테지만 언젠가는 해야겠지 그대 이유 같은 거 찾는 얼굴 말아요 우리는 충분히 할 만큼 했는걸 그러니 더 아무 말도 말아줘 그저 날 보면서 예전처럼 웃어줘 이제 이별 뒷면에 서있는 우리 내게 넌 벅차도록 행복했던 꿈 이제 마지막 장을 넘겨야겠어 많이 아플 테지만 언젠가는 해야겠지 후회하지 마요 우리 같이 나눈 시간 그 한 순간도 의미 없는 날은 없었고 또 다시 가도 너일 테니까 이제 내게 넌 벅차도록 행복했던 꿈 이제 마지막 장을 넘겨야겠어 많이 아플 테지만 언젠가는 해야겠지 고마웠어 여기까지 ,58858,508
송하예,운명이 우릴 갈라놓아도,2022-06-12,그대의 품에 두눈을 감고 슬픈 날들은 잊어요 거친 세상에 지켜온 믿음 그마음 하나 남아있다면 운명이 우릴 갈라놓아도 꼭 잡은 이손 놓치말아요 찬란한 물결 꽃이 되는 사랑 우우우우 one love 그대의 품에 두눈을 감고 아픈 날들을 잊어요 바람속에서 지켜온 믿음 그마음 하나 남아있다면 운명이 우릴 갈라놓아도 꼭 잡은 이손 놓치말아요 찬란한 물결 꽃이 되는 사랑 우우우우 one love 이대로 부서진다해도 그대곁에 있다면 행복해 운명이 잠든 저생에 만나 꼭 잡은 이손 놓치말아요 one love one love 그댄 나의 사랑 우우우우 one love one love ,2787,509
교이,그게맞아 (Feat. 송현근),2018-05-04,이제 와 왜 그래 이럴거면 조금 더 사랑해주지 내가 조금 덜 아프게 이제 좀 그만해 나 또 다시 아프기가 싫어 끝까지 너밖에 모르네 그때의 너처럼 지금의 너처럼 이제 나도 나만 생각할래 안 된다는 거 잘 알잖아 너도 우린 여기서 끝내는 게 맞아 내가 널 얼마나 힘들게 겨우 이렇게 널 잊었는데 어떻게 잡은 맘인데 나보고 어쩌자는 거야 이렇게 이기적인 니가 뭐가 그렇게나 좋다고 바보같이 또 난 또 흔들리고 있다 다 알면서도 모른 척 내가 더 잘한다면 돌아갈 수 있다 생각하고 노력해봤어 그게 아니더라 너는 이미 내게서 마음이 떠나버린 거야 그게 맞아 내가 널 얼마나 힘들게 겨우 이렇게 널 잊었는데 어떻게 잡은 맘인데 나보고 어쩌자는 거야 이렇게 이기적인 니가 뭐가 그렇게나 좋다고 바보같이 또 난 또 흔들리고 있다 안되는 거 알잖아 너도 너도 너도 제발 제발 이러지 말아줘 이래봤자 다시 넌 또 넌 또 우린 힘들기만 할거야 너도 잘 알잖아 내가 널 얼마나 힘들게 내가 널 얼마나 아프게 내가 널 얼마나 얼마나 기다렸는데 내가 널 어떻게 잊었는데 이제 와 또 흔들어 놓으면 어쩔 수가 없잖아 제발 이러지 말아줘 ,17299,510
JUNIEL,illa illa (일라 일라),2012-06-07,따스하게 부는 향기로운 바람 내 두 볼에 스치면 난 사랑했던 그대 얼굴이 떠오르죠 oh 길가에 숨어선 이름도 모르는 들꽃이 필 때쯤엔 기억 저 편에 감춰 둔 그대가 떠오르죠 My baby illa illa illa baby illa illa illa baby illa illa illa Never forget love 첫사랑은 아름다워서 첫사랑은 꽃이랍니다 봄이 오면 활짝 피는 오 눈이 부신 꽃처럼 첫사랑은 어린애처럼 첫사랑은 서투릅니다 사랑을 아낌없이 주고 갖질 못하니까 illa illa illa illa illa illa illa illa illa 나의사랑 good bye 까만 밤하늘에 그려있는 별이 그대 추억 불러오면 오랜 일기장 속에서 그댈 꺼내봅니다 My baby illa illa illa baby illa illa illa baby illa illa illa Never forget love 첫사랑은 아름다워서 첫사랑은 꽃이랍니다 봄이 오면 활짝 피는 오 눈이 부신 꽃처럼 첫사랑은 어린애처럼 첫사랑은 서투릅니다 사랑을 아낌없이 주고 갖질 못하니까 그땐 어려서 그땐 몰랐죠 오 이젠 알 것 같은데 난 그댈 그리며 불러보죠 illa illa illa illa illa illa illa illa illa illa illa never forget love 첫사랑은 아픈 걸 보면 첫사랑은 열병입니다 정신 없이 앓고 나면 오 어른이 되니까요 첫사랑은 안되니까요 첫사랑은 미련입니다 너무나 많이 사랑해서 갖질 못하니까 illa illa illa illa illa illa illa illa illa 나의 사랑 good bye illa illa illa illa illa illa illa illa illa 나의 사랑 good bye,85995,511
토이,세 사람 (With 성시경),2014-11-18,많은 사람들 분주한 인사 우리 모두 모인 게 얼마 만인 건지 하얀 드레스 멋있어진 녀석 정말 잘 어울려 오랜 내 친구들 축하해 기억나는지 우리 처음 만난 날 새로운 꿈 시작된 3월의 캠퍼스 어쩌면 그때 나는 알았나 봐 너 때문에 웃고 울게 될 나를 스무살 그 시절 우리 여름날의 멜로디 가슴속에 늘 숨 쉬는 풍경 하나 내 친구 처음 소개하던 날 뭔가 달라 보이던 너의 표정 넌 시작이었나 봐 둘만의 비밀이 닮아있는 말투가 친구라는 슬픈 말이 날 멈추게 만들어 말할 수 없는 나의 고백 용길 낼 수 없던 수많은 날 너의 연인은 내 오랜 친구 축복의 노래 꽃잎 흩날리면 눈부신 너의 모습 얼마나 예쁠까 매일 연습했던 말 이젠 안녕 스무살 그 시절 우리 여름날의 멜로디 아직 우릴 지켜준 나만의 약속 술 취해 혼자 비틀대던 밤 우리 셋 우정 지켜내잔 약속 내겐 사랑이었음을 둘만의 비밀이 닮아있는 말투가 친구라는 슬픈 말이 날 멈추게 만들어 말할 수 없는 나의 고백 용길 낼 수 없던 수많은 날 너의 연인은 내 오랜 친구 너에게 하고 싶은 말 넘쳐흐르는데 너만 보면 내 맘 춤을 추는데 모르는 사이 베어버린 상처가 널 보면 자꾸 아파 저 문이 열린다 그녀가 들어온다 난 고개를 들 수 없어 이렇게 좋은 날에 웃을 수밖에 없는 사람 언제나 날 반기는 두 사람 남겨진 나의 사랑 오 나의 청춘이 멀어진다 두 손 꼭 잡은 채로 그토록 원했던 오늘을 내 소중한 그녀의 내일을 나의 오랜 친구여 부탁해 ,113632,512
김동률,감사,2012-09-05,눈부신 햇살이 오늘도 나를 감싸며  살아있음을 그대에게  난 감사해요 부족한 내 마음이 누구에게  힘이 될 줄은 그것만으로 그대에게  난 감사해요 그 누구에게도 내 사람이란게  부끄럽지 않게 날 사랑할게요 단 한순간에도 나의  사람이란걸 후회하지 않도록  그댈 사랑할게요 이제야 나 태어난 그 이유를  알 것만 같아요  그대를 만나 죽도록  사랑하는게  누군가 주신 나의 행복이죠 그 어디에서도 나의 사람인걸 잊을 수 없도록 늘 함께 할게요 단 한순간에도  나의 사랑이란걸  아파하지 않도록 그대 사랑할게요 이제야 나 태어난 그 이유를 알 것만 같아요 그대를 만나  죽도록 사랑하는게  누군가 주신 내 삶의 이유라면 더이상 나에게 그 무엇도  바랄게 없어요 지금처럼만 서로를 사랑하는게  누군가 주신 나의 행복이죠  누군가 주신 나의 행복이죠 ,89052,513
포맨 (4MEN),너의 눈에 별이 떠 있어,2022-06-13,너의 눈에 별이 떠 있어 그 빛이 날 부르고 있어 날 봐요 그렇게 아른대게 웃으면 I'm into you 푸른빛이 밀려온다 꿈을 꾸듯 떨려온다 너에게로 빠져든다 너의 눈에 별이 떠 있어 그 빛 속에 내가 서 있어 소리 없이 네가 내게 떨어진다 내 가슴에 안긴다 My love My light My star 까만 밤이 눈부신 이유 모든 빛이 새로 시작된 이유 네가 내게 쏟아진다 나의 품에 번진다 My love My light My star 널 사랑해 아나요 입술에 그대 숨이 닿으면 Blow in my heart 바람빛이 불어온다 달콤함에 젖어 든다 너에게로 빠져든다 너의 눈에 별이 떠 있어 그 빛 속에 내가 서 있어 소리 없이 네가 내게 떨어진다 내 가슴에 안긴다 My love My light My star 널 사랑해 눈을 감아도 왜 눈이 부신 걸까 I'll be your night You Love me like a shining star 난 너의 품에 안기고 싶어 그 품 안에 숨 쉬고 싶어 찬란하게 네가 내게 달려온다 나를 끌어안는다 You're mine I'm yours Forever 까만 밤이 눈부신 이유 모든 빛이 새로 시작된 이유 네가 내게 쏟아진다 나의 품에 번진다 My love My light My star 널 사랑해 ,2014,514
윤민수(바이브),그녀를 찾아주세요,2022-04-03,안녕 안녕 안녕 사랑한 그녀가 보내 달라 하네요 안녕 안녕 안녕 밤하늘 별들아 그녀 가는 길 비춰주길 Good bye 하나만 알려주세요 어디에 살고 있을지 몇 년쯤이야 지금의 눈물쯤은 참을 수 있겠죠 시간이 흘러간 데도 십 년이 지나간 데도 그때도 사랑이면 난 어떡합니까 어디서 그녀를 찾아야 합니까 안녕 안녕 안녕 돌아선 그녀가 멀어져만 가네요 안녕 안녕 안녕 부탁해 빗물아 그녀 눈물을 씻겨 하나만 알려주세요 어디에 살고 있을지 몇 년쯤이야 지금의 눈물쯤은 참을 수 있겠죠 시간이 흘러간 데도 십 년이 지나간 데도 그때도 사랑이면 난 어떡합니까 어디서 그녀를 찾아야 합니까 들어줘요 내 사랑을 도와줘요 누구든지 알고 있다면 그 누구라도 데려다줘요 How do I live 하나만 전해주세요 그녀와 마주친다면 적어도 한땐 그녀의 전부였던 나의 그 이름을 그녀도 기억한다면 그녀도 울고 있다면 그리움 하나라도 꼭 남아있다면 내가 갈게요 날 기다려줘요 그녀를 꼭 찾아주세요 ,6449,515
리쌍,"TV를 껐네... (Feat. t윤미래, 권정열 Of 10cm)",2011-08-25,널 너무나 사랑해서 난 티비를 껐어 새빨간 니 입술 널 너무나 사랑해서 난 커텐을 쳤어 새빨간 니 입술 널 너무나 사랑해서 난 티비를 껐어 새빨간 니 입술 널 너무나 사랑해서 난 커텐을 쳤어 새빨간 니 입술  내 눈엔 그 어떤 선보다 아름다운 너의 몸매 검은 머리 너만의 향기에 나는 녹네 때론 몰래 응큼한 상상을해 그러다 욕심이 솟네 티비를 보다가도 거리를 걷다가도 시도때도 없이 난 너를 원해 못참아 어떻게 손만잡아 딱딱하게 말하지마 네가 날 딱딱하게 만들었잖아 널 너무 사랑해 내 모든 걸 다 주고 니 모든 걸 다 갖고싶어 더 가까이 널 안고싶어 내 몸을 적시고 엉덩이 토닥토닥 하고싶어  이 밤이 새도록 보여주고 싶어 어제와 또 다른 내 모습에 눈물까지 흘릴꺼야 이 밤이 새도록 보여주고 싶어 넌 너무 사랑스러워 언제나 나를 설레게 만들어 baby  널 너무나 사랑해서 난 티비를 껐어 새빨간 니 입술 널 너무나 사랑해서 난 커텐을 쳤어 새빨간 니 입술  더운데 갑자기 커텐을 왜 쳐 잘 보고 있는 티비는 또 왜꺼 그런 눈으로 왜 또 분위기 잡아 피곤해 피곤해 그냥 난 잘래 니 품에서 꿈꾸고 싶어 밤새 그만 좀 보채 오늘만 날이 아니잖아 좀 참아 착하지 내 남자 그냥 코 자자 삐지지말고 내 손을 잡아 어린애처럼 왜 또 등을 돌려  못말려 너란 남자 정말 웃겨 생각해볼게 어서 가서 불꺼  이대론 잠 못자요 넌 너무 아름다워 난 오늘 이 밤을 보내기엔 아쉬워요 오늘은 안된단 말 마요 그만 그만 그만  널 너무나 사랑해서 난 티비를 껐어 새빨간 니 입술 널 너무나 사랑해서 난 커텐을 쳤어 새빨간 니 입술 널 너무나 사랑해서 난 티비를 껐어 새빨간 니 입술 널 너무나 사랑해서 난 커텐을 쳤어 새빨간 니 입술  나를 설레게 만들어,64287,3
송하예,사랑했던 우리가 어떻게 친구가 되니,2021-10-23,넌 잘 지냈니 오랜만야 익숙한 네 목소리 넌 아무렇지도 않게 내게 인사해 꽤 시간이 흘러서 넌 편해졌나봐 나만 널 잊지를 못했나봐 남 얘기하듯이 그때 그랬지 하며 내가 좋아했었던 그 웃음 지으면 어떡해 사랑했던 우리가 어떻게 친구가 되니 너는 행복했는지 잊었나봐 내맘 흔들지 말고 내가 좋아한 웃음 짓지말고 그냥 지나가 난 너와는 달라 우리가 어떻게 친구가 되니 다른 사람 생겼냐고 내가 물었을땐 이미 넌 대답을 했던것 같아 남 얘기하듯이 그때 그랬지 하며 날 사랑할때의 그 눈빛 으로 날 보면 어떡해 사랑했던 우리가 어떻게 친구가 되니 너는 행복했는지 잊었나봐 내맘 흔들지 말고 내가 좋아한 웃음 짓지말고 그냥 지나가 난 너와는 달라 우리 헤어지던 날까지 싸웠었지만 좋았던 기억이 많아서 이렇게 널 그리워 하나봐 난 힘들어 편하게 널 대할 자신이 없어 우린 미치도록 사랑했잖아 내가 좋아한 웃음 지으며 내맘 흔들지 말고 가끔 이라도 전화 하지마 난 안돼 친구가 난 너와는 달라 우리가 어떻게 친구가 되니 ,12702,517
지아,바보에게 바보가,2017-12-12,너무 걱정하지는 마 보란 듯이 살아볼 거야 후회는 사치일 뿐이야 다시 시작해볼게 나 어제 또 울었어 나 어제 또 슬펐어 왜 이런 바보를 사랑한 거니 니 마음이 예뻐서 니 사랑이 고마워 이젠 니 손을 잡고 다시 태어날 거야 바보도 사랑합니다 보내주신 이 사람 이제 다시는 울지 않을 겁니다 나 이제 목숨을 걸고 세상 아픔에서 지켜줄게요 이 사람을 사랑합니다 널 위한다는 그 이유로 너를 보낼 뻔했어 나 그렇게 바보야 넌 내 사랑 바보고 서로를 많이도 울게 했었지 니 사랑이 없다면 널 만날 수 없다면 아마 나는 평생을 후회하며 살 거야 바보도 사랑합니다 보내주신 이 사람 이제 다시는 울지 않을 겁니다 나 이제 목숨을 걸고 세상 아픔에서 지켜줄게요 이 사람을 그대가 울 때면 내 가슴은 무너져요 무슨 남자의 눈물이 나처럼 서러워 노력해 볼게 널 위해 살아갈게 나약한 마음 따윈 모두 버릴게 우리의 사랑을 위해 너의 손을 잡고 놓지 않을게 사랑하는 내 사랑 바보야 ,32304,518
